CO_CNES,CO_UNIDADE,CO_UF,CO_IBGE,NU_CNPJ_MANTENEDORA,NO_RAZAO_SOCIAL,NO_FANTASIA,CO_NATUREZA_ORGANIZACAO,DS_NATUREZA_ORGANIZACAO,TP_GESTAO,CO_NIVEL_HIERARQUIA,DS_NIVEL_HIERARQUIA,CO_ESFERA_ADMINISTRATIVA,DS_ESFERA_ADMINISTRATIVA,CO_ATIVIDADE,TP_UNIDADE,CO_CEP,NO_LOGRADOURO,NU_ENDERECO,NO_BAIRRO,NU_TELEFONE,NU_LATITUDE,NU_LONGITUDE,CO_TURNO_ATENDIMENTO,DS_TURNO_ATENDIMENTO,NU_CNPJ,NO_EMAIL,CO_NATUREZA_JUR,ST_CENTRO_CIRURGICO,ST_CENTRO_OBSTETRICO,ST_CENTRO_NEONATAL,ST_ATEND_HOSPITALAR,ST_SERVICO_APOIO,ST_ATEND_AMBULATORIAL,CO_MOTIVO_DESAB,CO_AMBULATORIAL_SUS,leitos
8028,3534400008028,35,353440,46523171000104.0,PREFEITURA DO MUNICIPIO DE OSASCO,HOSPITAL MUNICIPAL ANTONIO GIGLIO,,,M,,,M ,MUNICIPAL,4,5,6013070,RUA PEDRO FIORETTI,48,CENTRO,(11)2183-9333,-23.53232235,-46.77712773,6,"ATENDIMENTO CONTINUO DE 24 HORAS/DIA (PLANTAO:INCLUI SABADOS, DOMINGOS E FERIADOS)",46523171000368.0,,1244,1.0,0.0,0.0,1.0,1,1,,SIM,182
8052,3534400008052,35,353440,46374500000194.0,SECRETARIA DE ESTADO DA SAUDE DE SAO PAULO,HOSPITAL REGIONAL DR VIVALDO MARTINS SIMOES OSASCO,,,E,,,E ,ESTADUAL,4,5,6216240,RUA ARI BARROSO,355,PRESIDENTE ALTINO,(11) 3683-3077,-23.5249302,-46.77193898,6,"ATENDIMENTO CONTINUO DE 24 HORAS/DIA (PLANTAO:INCLUI SABADOS, DOMINGOS E FERIADOS)",46374500012524.0,hrofaturamentosame@gmail.com,1023,1.0,0.0,1.0,1.0,1,1,,SIM,182
8923,3547800008923,35,354780,46522942000130.0,PREFEITURA MUNICIPAL DE SANTO ANDRE,CENTRO HOSPITALAR DE SANTO ANDRE DR NEWTON DA COSTA BRANDAO,,,M,,,M ,MUNICIPAL,5,5,9030320,AVENIDA JOAO RAMALHO,326,VILA ASSUNCAO,(11) 4433-3600,-23.6659455,-46.52757351,6,"ATENDIMENTO CONTINUO DE 24 HORAS/DIA (PLANTAO:INCLUI SABADOS, DOMINGOS E FERIADOS)",,,1244,1.0,0.0,0.0,1.0,1,1,,SIM,237
9539,3549900009539,35,354990,,INSTITUTO DAS PEQUENAS MISSIONARIAS DE MARIA IMACULADA,HOSPITAL MATERNO INFANTIL ANTONINHO DA ROCHA MARMO,,,M,,,M ,MUNICIPAL,4,5,12245280,AVENIDA HEITOR VILLA LOBOS,1961,VILA RENATA,12 3797-0822,-23.2055964,-45.8856918,6,"ATENDIMENTO CONTINUO DE 24 HORAS/DIA (PLANTAO:INCLUI SABADOS, DOMINGOS E FERIADOS)",60194990000763.0,diretoria@antoninhomarmo.org.br,3999,1.0,1.0,1.0,1.0,1,1,,SIM,49
9601,3549900009601,35,354990,,INSTITUTO DAS PEQUENAS MISSIONARIAS DE MARIA IMACULADA,HOSPITAL PIO XII,,,M,,,M ,MUNICIPAL,4,5,12212110,RUA PARAGUASSU,51,SANTANA,12 39283344,-23.1631693,-45.90058335,6,"ATENDIMENTO CONTINUO DE 24 HORAS/DIA (PLANTAO:INCLUI SABADOS, DOMINGOS E FERIADOS)",60194990000682.0,"erika.zanni@hpioxii.org.br, diretoria@hpioxii.org.br",3999,1.0,0.0,0.0,1.0,1,1,,SIM,86
9628,3549900009628,35,354990,46643466000106.0,PREFEITURA MUNICIPAL DE SAO JOSE DOS CAMPOS,HOSPITAL MUNICIPAL DR JOSE DE CARVALHO FLORENCE,,,M,,,M ,MUNICIPAL,3,5,12220280,RUA SAIGIRO NAKAMURA,800,VILA INDUSTRIAL,12 39013400,-23.1806184,-45.85483411,6,"ATENDIMENTO CONTINUO DE 24 HORAS/DIA (PLANTAO:INCLUI SABADOS, DOMINGOS E FERIADOS)",,camaganha@uol.com.br,1244,1.0,1.0,1.0,1.0,1,1,,SIM,281
26417,3549900026417,35,354990,46643466000106.0,PREFEITURA MUNICIPAL DE SAO JOSE DOS CAMPOS,HOSPITAL DE CLINICAS SUL,,,M,,,M ,MUNICIPAL,4,5,12235621,PRACA NATAL,55,PARQUE INDUSTRIAL,12 39358100,-23.23799427,-45.90937614,6,"ATENDIMENTO CONTINUO DE 24 HORAS/DIA (PLANTAO:INCLUI SABADOS, DOMINGOS E FERIADOS)",46643466000530.0,"hcs05@sjc.sp.gov.br, cnes@hmtj.org.br",1244,1.0,0.0,0.0,1.0,1,1,,SIM,35
80470,3543400080470,35,354340,,HOSPITAL ESPECIALIZADO NO TRATAMENTO DE ALCOOL E DROGAS AS,HOSPITAL FUNDACAO PENTEADO RIBEIRAO PRETO,,,M,,,M ,MUNICIPAL,4,5,14095440,ANTONIO GOMES DA SILVA JUNIOR,625,PARQUE RESIDENCIAL L,16 32341290,-21.1885534,-47.761084,4,"ATENDIMENTO NOS TURNOS DA MANHA, TARDE E NOITE",3401600000150.0,abertura.analise@gmail.com,3999,0.0,0.0,0.0,1.0,1,1,,NAO,0
81825,3507500081825,35,350750,45425899000122.0,UNIMED DE BOTUCATU COOPERATIVA DE TRABALHO MEDICO,HOSPITAL UNIMED BOTUCATU II,,,M,,,M ,MUNICIPAL,4,5,18606730,RUA EMILIO CANI,1178,VILA SANTA TEREZINHA,14 3514-0500,-22.89957325,-48.45198901,6,"ATENDIMENTO CONTINUO DE 24 HORAS/DIA (PLANTAO:INCLUI SABADOS, DOMINGOS E FERIADOS)",45425899000980.0,diretoriatecnica@h.unimedbotucatu.coop.br,2143,1.0,0.0,0.0,1.0,1,1,,NAO,80
92894,3510500092894,35,351050,46374500000194.0,SECRETARIA DO ESTADO DA SAUDE DE SAO PAULO,HOSPITAL REGIONAL DO LITORAL NORTE,,,E,,,E ,ESTADUAL,4,5,11672032,RUA PRUDENCIA SANCHES FROILE MANSANO,1200,PONTAL DE SANTA MARI,12 38871058,-23.623372,-45.417158,4,"ATENDIMENTO NOS TURNOS DA MANHA, TARDE E NOITE",46374500028609.0,secretariatecnica.hrln@isgsaude.org,1023,1.0,0.0,0.0,1.0,1,1,,SIM,176
102075,3550300102075,35,355030,46392130000380.0,PREFEITURA DO MUNICIPIO DE SAO PAULO,HOSPITAL MUNICIPAL SANTA DULCE DOS POBRES,,,M,,,M ,MUNICIPAL,4,5,1309010,RUA ANTONIO CARLOS,122,CONSOLACAO,42102970,-23.4757,-46.6974281,4,"ATENDIMENTO NOS TURNOS DA MANHA, TARDE E NOITE",,,1031,0.0,0.0,0.0,0.0,1,1,,NAO,60
102105,3550300102105,35,355030,46392130000380.0,SECRETARIA MUNICIPAL DA SAUDE,HOSPITAL MUNICIPAL BRASILANDIA,,,M,,,M ,MUNICIPAL,4,5,2806160,MICHIHISA MURATA,150,JARDIM MARISTELA,113135-7060,-23.4757036,-46.6974047,6,"ATENDIMENTO CONTINUO DE 24 HORAS/DIA (PLANTAO:INCLUI SABADOS, DOMINGOS E FERIADOS)",46392148006070.0,DMELLONE@PREFEITURA.SP.GOV.BR,1031,1.0,0.0,0.0,1.0,1,1,,SIM,261
110612,3519070110612,35,351907,67995027000132.0,PREFEITURA MUNICIPAL DE HORTOLANDIA,UNIDADE RESPIRATORIA NOVA HORTOLANDIA,,,M,,,M ,MUNICIPAL,4,5,13183611,RUA JOAO RIBEIRO EVANGELISTA,200,JD NOVA HORTOLANDIA,,-22.85804493,-47.22001076,6,"ATENDIMENTO CONTINUO DE 24 HORAS/DIA (PLANTAO:INCLUI SABADOS, DOMINGOS E FERIADOS)",,,1244,0.0,0.0,0.0,0.0,1,1,4.0,SIM,0
115509,3528500115509,35,352850,46523163000150.0,MUNICIPIO DE MAIRIPORA,HOSPITAL DE CLINICAS ANJO GABRIEL,,,M,,,M ,MUNICIPAL,4,5,7629658,RUA SAO JUDAS TADEU,200,CAPOAVINHA,(11)44192521,-23.27696793,-46.56528899,6,"ATENDIMENTO CONTINUO DE 24 HORAS/DIA (PLANTAO:INCLUI SABADOS, DOMINGOS E FERIADOS)",,gerenciamairipora@alphainstituto.com.br,1244,0.0,0.0,0.0,0.0,1,1,,SIM,31
127604,3505700127604,35,350570,46523015000135.0,MUNICIPIO DE BARUERI,HOSPITAL DE RETAGUARDA DO JARDIM PAULISTA,,,M,,,M ,MUNICIPAL,4,5,6447020,AVENIDA CIDADE DE ITU,346,JARDIM ITAPARICA,(11) 3164-9591,-23.54080587,-46.88161254,4,"ATENDIMENTO NOS TURNOS DA MANHA, TARDE E NOITE",,saude.scnes@barueri.sp.gov.br,1244,0.0,0.0,0.0,1.0,1,1,,SIM,61
133035,3513400133035,35,351340,46668596000101.0,PREFEITURA MUNICIPAL DE CRUZEIRO,CENTRO INTEGRADO DE SAUDE,,,M,,,M ,MUNICIPAL,4,5,12701370,JOAQUIM PRADO,S/N,CENTRO,8008789628,-22.574179,-44.964681,4,"ATENDIMENTO NOS TURNOS DA MANHA, TARDE E NOITE",,SAUDE@CRUZEIRO.SP.GOV.BR,1244,,,,,1,1,10.0,NAO,0
158100,3550300158100,35,355030,46392130000380.0,PREFEITURA DO MUNICIPIO DE SAO PAULO,HOSP MUN BRIGADEIRO,,,M,,,M ,MUNICIPAL,4,5,1401002,AVENIDA BRIGADEIRO LUIS ANTONIO,4805,JARDIM PAULISTA,,-23.548,-46.636,6,"ATENDIMENTO CONTINUO DE 24 HORAS/DIA (PLANTAO:INCLUI SABADOS, DOMINGOS E FERIADOS)",,diradm.hospbrigadeiro@spdm-pais.org.br,1031,0.0,0.0,0.0,1.0,1,1,3.0,NAO,0
158119,3550300158119,35,355030,46392130000380.0,PREFEITURA DO MUNICIPIO DE SAO PAULO,COMPLEXO HOSPITALAR MUNICIPAL SOROCABANA,,,M,,,M ,MUNICIPAL,4,5,5041001,RUA FAUSTOLO,1633,LAPA,,-23.548,-46.636,6,"ATENDIMENTO CONTINUO DE 24 HORAS/DIA (PLANTAO:INCLUI SABADOS, DOMINGOS E FERIADOS)",,,1031,0.0,0.0,0.0,0.0,1,1,4.0,NAO,0
161438,3550300161438,35,355030,46392130000380.0,INTS INSTITUTO NACIONAL DE TECNOLOGIA E SAUDE,HOSPITAL MUNICIPAL GUARAPIRANGA,,,M,,,M ,MUNICIPAL,4,5,4916000,ESTRADA DA RIVIERA,4742,RIVIERA PAULISTA,(11) 3113-9592,-23.705922,-46.741949,6,"ATENDIMENTO CONTINUO DE 24 HORAS/DIA (PLANTAO:INCLUI SABADOS, DOMINGOS E FERIADOS)",,,1031,0.0,0.0,0.0,1.0,1,1,,SIM,186
175277,3506000175277,35,350600,,FUNDACAO PARA O DESENVOLVIMENTO MEDICO E HOSPITALAR,HOSPITAL DAS CLINICAS BAURU,,,E,,,E ,ESTADUAL,4,5,17012900,RUA SILVIO MARCHIONE 20 QUADRA 3,320,VILA NOVA CIDADE UNI,14 38814800,-22.315,-49.061,6,"ATENDIMENTO CONTINUO DE 24 HORAS/DIA (PLANTAO:INCLUI SABADOS, DOMINGOS E FERIADOS)",46230439001698.0,diretoria@famesp.org.br,3069,,,,,1,1,4.0,NAO,0
249491,3515000249491,35,351500,,ESPACO TERRA ASSISTENCIA A SAUDE LTDA,ESPACO MARIAZINHA,,,M,,,M ,MUNICIPAL,4,5,6846035,ESTRADA JOSE MATIAS DE CAMARGO,491,INVERNADA,11-4085-9057,-23.649,-46.852,6,"ATENDIMENTO CONTINUO DE 24 HORAS/DIA (PLANTAO:INCLUI SABADOS, DOMINGOS E FERIADOS)",10934632000186.0,,2062,0.0,0.0,0.0,0.0,1,1,4.0,NAO,0
255661,3550300255661,35,355030,,IMPAR SERVICOS HOSPITALARES S A,IMPAR SERVICOS HOSPITALARES FILIAL SANTA PAULA,,,M,,,M ,MUNICIPAL,4,5,4556901,STO AMARO,2468,BROOKLIN PAULISTA,11 31479999,-23.64251924,-46.69983923,6,"ATENDIMENTO CONTINUO DE 24 HORAS/DIA (PLANTAO:INCLUI SABADOS, DOMINGOS E FERIADOS)",60884855003331.0,CONTASAPAGAR1@REDEIMPAR.COM.BR,2054,0.0,0.0,0.0,0.0,1,1,,SIM,199
263192,3550300263192,35,355030,,PREVENT SENIOR ATENDIMENTO A SAUDE LTDA,HOSPITAL SANCTA MAGGIORE DUBAI,,,M,,,M ,MUNICIPAL,4,5,5686902,RUA FRANCISCO TRAMONTANO,100,REAL PARQUE,1140859057,-23.617749,-46.7051417,6,"ATENDIMENTO CONTINUO DE 24 HORAS/DIA (PLANTAO:INCLUI SABADOS, DOMINGOS E FERIADOS)",10934632004688.0,luciana.tamaoki@preventsenior.com.br,2062,1.0,0.0,0.0,1.0,1,1,,NAO,171
265187,3550700265187,35,355070,46482832000192.0,PREFEITURA MUNICIPAL DE SAO SEBASTIAO,HOSPITAL DE CLINICAS DE SAO SEBASTIAO COSTA SUL,,,M,,,M ,MUNICIPAL,4,5,11618107,AVENIDA WALKIR VERGANI,878,BOICUCANGA,,-23.78379362,-45.62828064,6,"ATENDIMENTO CONTINUO DE 24 HORAS/DIA (PLANTAO:INCLUI SABADOS, DOMINGOS E FERIADOS)",,,1244,1.0,1.0,1.0,1.0,1,1,,SIM,17
393290,3550300393290,35,355030,,PREVENT SENIOR ATENDIMENTO A SAUDE LTDA,HOSPITAL E PRONTO ATENDIMENTO SANCTA MAGGIORE RUSSIA,,,M,,,M ,MUNICIPAL,4,5,5513100,AVENIDA PROFESSOR FRANCISCO MORATO,1133,BUTANTA,(11) 40859000,-23.5853458,-46.7215587,6,"ATENDIMENTO CONTINUO DE 24 HORAS/DIA (PLANTAO:INCLUI SABADOS, DOMINGOS E FERIADOS)",10934632004840.0,luciana.tamaoki@preventsenior.com.br,2062,1.0,0.0,0.0,1.0,1,1,,NAO,43
414808,3550300414808,35,355030,,CENTRO DE PARTO HUMANIZADO VILA MARIANA EIRELI,CRIA CASA DE PARTO,,,M,,,M ,MUNICIPAL,4,5,4120070,RUA DOUTOR LOPES DE ALMEIDA,16,VILA MARIANA,11998067090,-23.5958821,-46.6319201,6,"ATENDIMENTO CONTINUO DE 24 HORAS/DIA (PLANTAO:INCLUI SABADOS, DOMINGOS E FERIADOS)",36930094000145.0,mmattos@gmail.com,2062,0.0,1.0,0.0,1.0,1,1,8.0,NAO,0
419214,3506000419214,35,350600,,ONE CARE ATENDIMENTO HOSPITALAR LTDA,REDE ONE CARE,,,M,,,M ,MUNICIPAL,4,5,17018786,AVENIDA AFFONSO JOSE AIELLO,14125,RESIDENCIAL VILAGGIO,(14) 3214-3506,-22.3662044,-49.0555454,4,"ATENDIMENTO NOS TURNOS DA MANHA, TARDE E NOITE",37009702000146.0,atendimento@redeone.care.com.br,2054,1.0,0.0,0.0,1.0,1,1,,NAO,3
424870,3511700424870,35,351170,,RENOVARE CENTRO DE SERVICO TERAPEUTICO LTDA,HOSPITAL TERAPEUTICO RENOVARE,,,M,,,M ,MUNICIPAL,4,5,13515000,VIA DOUTOR CELSO SILVEIRA MELLO,1,JARDIM ALVORADA II,19 996385550,-22.51184546,-47.78375386,6,"ATENDIMENTO CONTINUO DE 24 HORAS/DIA (PLANTAO:INCLUI SABADOS, DOMINGOS E FERIADOS)",14687471000124.0,renovareadm20@gmail.com,2062,0.0,0.0,0.0,0.0,1,1,,NAO,2
473561,3552500473561,35,355250,,MEDCARE SUZANO SERVICOS MEDICOS LTDA,HOSPITAL SAINT NICHOLAS MEDICAL,,,M,,,M ,MUNICIPAL,4,5,8676000,AVENIDA ANTONIO MARQUES FIGUEIRA,200,CENTRO,1147448750,-23.5371165,-46.3080438,6,"ATENDIMENTO CONTINUO DE 24 HORAS/DIA (PLANTAO:INCLUI SABADOS, DOMINGOS E FERIADOS)",1531867000489.0,,2062,1.0,0.0,0.0,1.0,1,1,,NAO,96
507733,3550300507733,35,355030,,HOSPITAL ESPORTE E SAUDE LTDA,HOSPITAL ESPORTE E SAUDE BR SURGERY,,,M,,,M ,MUNICIPAL,4,5,4304010,RUA FAGUNDES FILHO,475,VILA MONTE ALEGRE,11 4369-4300,-23.6265,-46.6293,4,"ATENDIMENTO NOS TURNOS DA MANHA, TARDE E NOITE",7683694000158.0,ROBERTO@BRSURGERY.COM.BR,2062,1.0,0.0,0.0,1.0,1,1,,NAO,14
605107,3552200605107,35,355220,46634044000174.0,PREFEITURA MUNICIPAL DE SOROCABA,CENTRO DE TRANSICAO E ESTABILIZACAO CTE SAO GUILHERME,,,M,,,M ,MUNICIPAL,4,5,18074651,RUA BELMIRO MOREIRA SOARES,1100,JARDIM SAO GUILHERME,15 3239-9245,-23.4514224,-47.4884494,6,"ATENDIMENTO CONTINUO DE 24 HORAS/DIA (PLANTAO:INCLUI SABADOS, DOMINGOS E FERIADOS)",,,1244,0.0,0.0,0.0,0.0,0,1,10.0,SIM,0
605484,3552200605484,35,355220,,AMHE MED ASSISTENCIA A SAUDE LTDA,AMHE MED SOROCABA,,,M,,,M ,MUNICIPAL,4,5,18015000,RUA PEDRO JOSE SENGER,213,VILA HARO,,-23.49882431,-47.4442327,6,"ATENDIMENTO CONTINUO DE 24 HORAS/DIA (PLANTAO:INCLUI SABADOS, DOMINGOS E FERIADOS)",29174910000253.0,adm.hospital@amhemed.com.br,2062,1.0,0.0,0.0,1.0,0,1,,SIM,100
625396,3557100625396,35,355710,46599809000182.0,PREFEITURA MUNICIPAL DE VOTUPORANGA,UNIDADE DE SUPORTE VENTILATORIO DE VOTUPORANGA,,,M,,,M ,MUNICIPAL,4,5,15502328,RUA OSVALDO PADOVEZ,S/N,PARQUE VILA SAUDE,(17)34051446,-20.4254567,-49.9799557,6,"ATENDIMENTO CONTINUO DE 24 HORAS/DIA (PLANTAO:INCLUI SABADOS, DOMINGOS E FERIADOS)",,secretariasaude@votuporanga.sp.gov.br,1244,0.0,0.0,0.0,0.0,1,1,10.0,SIM,0
625469,3552200625469,35,355220,46634044000174.0,MUNICIPIO DE SOROCABA,UPH ZO UNIDADE DE ATENDIMENTO DE SINDROME GRIPAL,,,M,,,M ,MUNICIPAL,4,5,18043004,AVENIDA GENERAL CARNEIRO,1670,VILA LUCY,15 3229-0410,-23.5066889,-47.4837477,6,"ATENDIMENTO CONTINUO DE 24 HORAS/DIA (PLANTAO:INCLUI SABADOS, DOMINGOS E FERIADOS)",,ctezo.faturamento1@institutosoleil.com.br,1244,0.0,0.0,0.0,0.0,0,1,10.0,SIM,0
652601,3545800652601,35,354580,,HOSPITAL SAMARITANO DE SANTA BARBARA DOESTE,HOSPITAL SAMARITANO DE SANTA BARBARA DOESTE,,,M,,,M ,MUNICIPAL,4,5,13454214,RUA LIMEIRA,450,LAGOA SECA,19 999284187,-22.7336134,-47.3770967,4,"ATENDIMENTO NOS TURNOS DA MANHA, TARDE E NOITE",40920115000119.0,MIHELLE@SAMARITANOAMERICANA,2062,1.0,1.0,1.0,1.0,1,1,,NAO,22
653101,3529400653101,35,352940,,HOSPITAL SAGRADA FAMILIA EIRELI,HOSPITAL SAGRADA FAMILIA,,,M,,,M ,MUNICIPAL,4,5,9360540,RUA VICENTE ALETTO,31,JARDIM ANCHIETA,114615 6682,-23.68348915,-46.46029314,4,"ATENDIMENTO NOS TURNOS DA MANHA, TARDE E NOITE",28820713000625.0,gerencia.adimistrativa@hospsagradafamilia.com.br,2062,1.0,0.0,0.0,1.0,1,0,,NAO,110
663913,3550300663913,35,355030,,ASSOCIACAO HOSPITALAR JAGUARA,HOSPITAL SAINT PATRICK,,,M,,,M ,MUNICIPAL,4,5,5114000,AV CANDIDO PORTINARI,616,VILA JAGUARA,,-23.5083469,-46.7551251,6,"ATENDIMENTO CONTINUO DE 24 HORAS/DIA (PLANTAO:INCLUI SABADOS, DOMINGOS E FERIADOS)",33043256000216.0,regulatorio@cnesolution.com.br,3999,0.0,0.0,0.0,0.0,1,1,,NAO,16
664200,3550300664200,35,355030,46392130000380.0,PREFEITURA DO MUNICIPIO DE SAO PAULO,UNIDADE HOSPITALAR SANTO AMARO,,,M,,,M ,MUNICIPAL,3,5,4753060,AV ADOLFO PINHEIRO,339,SANTO AMARO,11 55556767,-23.3253,-46.381,6,"ATENDIMENTO CONTINUO DE 24 HORAS/DIA (PLANTAO:INCLUI SABADOS, DOMINGOS E FERIADOS)",,hd.santoamaro@ints.org.br,1031,1.0,0.0,0.0,1.0,1,1,4.0,NAO,0
665037,3552200665037,35,355220,46634044000174.0,PREFEITURA MUNICIPAL DE SOROCABA,UPH ZONA NORTE UNIDADE DE ATENDIMENTO DE SINDROME GRIPAL,,,M,,,M ,MUNICIPAL,4,5,18070671,AVENIDA IPANEMA,490,VILA NOVA SOROCABA,1532193190,-23.4415153,-47.5331569,6,"ATENDIMENTO CONTINUO DE 24 HORAS/DIA (PLANTAO:INCLUI SABADOS, DOMINGOS E FERIADOS)",,dirtecuphzn@institutodiretrizes.com.br,1244,0.0,0.0,0.0,0.0,0,1,10.0,SIM,0
684651,3552200684651,35,355220,46634044000174.0,PREFEITURA MUNICIPAL DE SOROCABA,UPA DO EDEN UNIDADE DE ATENDIMENTO DE SINDROME GRIPAL,,,M,,,M ,MUNICIPAL,4,5,18103750,RUA MIGUEL JOSE GIMENES,75,JD PORTOBELLO,15 3333-2169,-23.427591,-47.415091,6,"ATENDIMENTO CONTINUO DE 24 HORAS/DIA (PLANTAO:INCLUI SABADOS, DOMINGOS E FERIADOS)",,marcio.luchesi@upaeden.org.br,1244,0.0,0.0,0.0,0.0,0,1,10.0,SIM,0
684910,3548500684910,35,354850,,UNIMED DE SANTOS COOPERATIVA DE TRABALHO MEDICO,CENTRO MEDICO,,,M,,,M ,MUNICIPAL,4,5,11075320,RUA PARANA,191,VILA MATHIAS,(13) 2102-8100,-23.94833,-46.33286,6,"ATENDIMENTO CONTINUO DE 24 HORAS/DIA (PLANTAO:INCLUI SABADOS, DOMINGOS E FERIADOS)",58229691001909.0,,2143,1.0,0.0,0.0,1.0,1,1,,NAO,0
701394,3550300701394,35,355030,,HOSPITAL E MATERNIDADE VIDAS LTDA,HOSPITAL VIDAS ALTA COMPLEXIDADE,,,M,,,M ,MUNICIPAL,4,5,4692000,PROFA MARIA DE LOURDES DE S NOGUEIRA,89,VILA GEA,11 33219450,-23.67544662,-46.6865035,6,"ATENDIMENTO CONTINUO DE 24 HORAS/DIA (PLANTAO:INCLUI SABADOS, DOMINGOS E FERIADOS)",96534300000391.0,CONTABILIDADE@HOSPITALVIDAS.COM.BR,2062,1.0,0.0,0.0,1.0,1,1,,NAO,61
743585,3509500743585,35,350950,,FUNDACAO DA AREA DA SAUDE DE CAMPINAS FASCAMP,IOU INSTITUTO DE OTORRINOLARINGOLOGIA E CABECA E PESCOCO D,,,M,,,M ,MUNICIPAL,4,5,13083891,AV PREFEITO JOSE MAGALHAES TEIXEIRA,450,CIDADE UNIVERSITARIA,32890394,-22.8260494,-47.0643169,3,ATENDIMENTOS NOS TURNOS DA MANHA E A TARDE,17893567000137.0,contato@fascamp.org.br,3069,1.0,0.0,0.0,1.0,1,0,4.0,NAO,0
756350,3549800756350,35,354980,,H B SAUDE PRESTACAO DE SERVICOS MEDICOS LTDA,UNIDADE AIR,,,M,,,M ,MUNICIPAL,4,5,15090365,AVENIDA ANISIO HADDAD,7195,UNIVERSITARIO,17 4009-6711,-20.84278,-49.40187,6,"ATENDIMENTO CONTINUO DE 24 HORAS/DIA (PLANTAO:INCLUI SABADOS, DOMINGOS E FERIADOS)",7179361003101.0,liziane.alves@hbsaude.com.br,2062,0.0,0.0,0.0,0.0,1,1,10.0,NAO,0
789585,3525300789585,35,352530,,UNIMED REGIONAL JAU COOPERATIVA DE TRABALHO MEDICO,HOSPITAL UNIMED REGIONAL JAU,,,M,,,M ,MUNICIPAL,4,5,17213700,ANTONIO DE ALMEIDA PACHECO,1991,2A ZONA INDUSTRIAL,14 36028900,-22.30440258,-48.59124184,6,"ATENDIMENTO CONTINUO DE 24 HORAS/DIA (PLANTAO:INCLUI SABADOS, DOMINGOS E FERIADOS)",2322043000542.0,diretoria@unimedjau.com.br,2143,1.0,1.0,0.0,1.0,1,1,,NAO,112
792063,3552200792063,35,355220,46634044000174.0,MUNICIPIO DE SOROCABA,UPH ZONA LESTE UNIDADE DE ATENDIMENTO DE SINDROME GRIPAL,,,M,,,M ,MUNICIPAL,4,5,18020003,RUA CORONEL NOGUEIRA PADILHA,2567,VILA HORTENCIA,15 3333-0100,-23.5090511,-47.4908614,6,"ATENDIMENTO CONTINUO DE 24 HORAS/DIA (PLANTAO:INCLUI SABADOS, DOMINGOS E FERIADOS)",,gerencia@uphleste.org.br,1244,0.0,0.0,0.0,0.0,1,1,10.0,NAO,0
837164,3505500837164,35,350550,,HOSPITAL DIA DE BARRETOS LTDA,HOSPITAL VILLAGE,,,M,,,M ,MUNICIPAL,4,5,14783165,AVENIDA DOUTOR ARQUIMEDES MACHADO,15,JARDIM RAMOS,17 33211212,-20.56483394,-48.58375311,6,"ATENDIMENTO CONTINUO DE 24 HORAS/DIA (PLANTAO:INCLUI SABADOS, DOMINGOS E FERIADOS)",32901144000105.0,,2062,1.0,1.0,1.0,1.0,1,1,,SIM,16
864560,3539500864560,35,353950,,HAPVIDA ASSISTENCIA MEDICA S A,PA PITANGUEIRAS,,,M,,,M ,MUNICIPAL,4,5,14750000,ACRE,139,CENTRO,85 40023633,-21.011493,-48.217806,6,"ATENDIMENTO CONTINUO DE 24 HORAS/DIA (PLANTAO:INCLUI SABADOS, DOMINGOS E FERIADOS)",63554067032120.0,FISCAL@HAPVIDA.COM.BR,2054,0.0,0.0,0.0,0.0,1,1,,NAO,6
911437,3549700911437,35,354970,,UNIMED DE SAO JOSE DO RIO PARDO COOP TRABALHO MEDICO,HOSPITAL UNIMED,,,M,,,M ,MUNICIPAL,4,5,13720482,RUA ALEXANDRE CARLOS DE MELO,118,JARDIM AEROPORTO,19 36828888,-21.61318879,-46.88878349,6,"ATENDIMENTO CONTINUO DE 24 HORAS/DIA (PLANTAO:INCLUI SABADOS, DOMINGOS E FERIADOS)",96182068000701.0,,2143,1.0,1.0,1.0,1.0,1,1,,NAO,7
940402,3548800940402,35,354880,,METIE MEDICINA ESPECIALIZADA EM TRATAMENTO INTENSIVO EMERG,HOSPITAL SANTA ANA,,,M,,,M ,MUNICIPAL,4,5,9570400,CAVALHEIRO ERNESTO GIULIANO,979,SAO JOSE,11 39874411,-23.6347531,-46.56249395,6,"ATENDIMENTO CONTINUO DE 24 HORAS/DIA (PLANTAO:INCLUI SABADOS, DOMINGOS E FERIADOS)",38306894000115.0,analista.qualidade@hospitalstaclara.com.br,2062,1.0,0.0,0.0,1.0,1,1,,NAO,261
955736,3550300955736,35,355030,,PREVENT SENIOR ATENDIMENTO A SAUDE LTDA,HOSPITAL E PRONTO ATENDIMENTO SANCTA MAGGIORE PARIS,,,M,,,M ,MUNICIPAL,4,5,4146050,RUA GENERAL CHAGAS SANTOS,314,VILA DA SAUDE,1140859000,-23.61825525,-46.6320921,6,"ATENDIMENTO CONTINUO DE 24 HORAS/DIA (PLANTAO:INCLUI SABADOS, DOMINGOS E FERIADOS)",10934632003363.0,luciana.tamaoki@preventsenior.com.br,2062,1.0,0.0,0.0,1.0,1,1,,NAO,60
962589,3548900962589,35,354890,45359213000142.0,UNIMED DE SAO CARLOS COOPERATIVA DE TRABALHO MEDICO,HOSPITAL UNIMED SAO CARLOS UNIDADE II,,,M,,,M ,MUNICIPAL,4,5,13560181,RUA SETE DE SETEMBRO,3033,VILA NERY,16 21077428-21077300,-22.01585263,-47.88072467,4,"ATENDIMENTO NOS TURNOS DA MANHA, TARDE E NOITE",45359213001548.0,secretaria.hospital2@unimedsaocarlos.com.br,2143,1.0,1.0,1.0,1.0,1,1,,NAO,44
993956,3550300993956,35,355030,,REDE DOR SAO LUIZ S A,MATERNIDADE SAO LUIZ STAR,,,M,,,M ,MUNICIPAL,4,5,4552050,RUA HELENA,29,VILA OLIMPIA,(11) 2121-1335,-23.5312499,-46.8341173,6,"ATENDIMENTO CONTINUO DE 24 HORAS/DIA (PLANTAO:INCLUI SABADOS, DOMINGOS E FERIADOS)",6047087011920.0,licenciamentosp@rededor.com.br,2046,1.0,1.0,1.0,1.0,1,1,,NAO,119
2022621,3509502022621,35,350950,,MATERNIDADE DE CAMPINAS,MATERNIDADE DE CAMPINAS,,,M,,,M ,MUNICIPAL,3,5,13023910,OROSIMBO MAIA,165,CENTRO,,-22.89936,-47.06323,6,"ATENDIMENTO CONTINUO DE 24 HORAS/DIA (PLANTAO:INCLUI SABADOS, DOMINGOS E FERIADOS)",46043980000100.0,,3999,1.0,1.0,0.0,1.0,1,1,,SIM,128
2022648,3509502022648,35,350950,,IRMANDADE DE MISERICORDIA DE CAMPINAS,HOSPITAL IRMAOS PENTEADO E SANTA CASA DE CAMPINAS,,,M,,,M ,MUNICIPAL,3,5,13010142,BENJAMIN CONSTANT,1657,CENTRO,,-22.901269,-47.056181,6,"ATENDIMENTO CONTINUO DE 24 HORAS/DIA (PLANTAO:INCLUI SABADOS, DOMINGOS E FERIADOS)",46045290000190.0,,3999,1.0,0.0,0.0,1.0,1,1,,SIM,138
2023016,3509402023016,35,350940,,CASA DE CARIDADE SAO VICENTE DE PAULO,CASA DE CARIDADE SAO VICENTE DE PAULO CAJURU,,,M,,,M ,MUNICIPAL,4,5,14240114,RUA DOUTOR MILTON MOURAO DE MATOS,460,CENTRO,(16)36673232,-21.2726046,-47.3060414,6,"ATENDIMENTO CONTINUO DE 24 HORAS/DIA (PLANTAO:INCLUI SABADOS, DOMINGOS E FERIADOS)",45968716000115.0,,3999,1.0,1.0,1.0,1.0,1,1,,SIM,46
2023148,3509502023148,35,350950,,ASSOCIACAO EVANGELICA BENEFICENTE DE CAMPINAS,HOSPITAL SAMARITANO DE CAMPINAS,,,M,,,M ,MUNICIPAL,4,5,13041304,ENGENHEIRO MONLEVADE,206,VILA JOAO JORGE,19 37361199,-22.91753009,-47.05994191,6,"ATENDIMENTO CONTINUO DE 24 HORAS/DIA (PLANTAO:INCLUI SABADOS, DOMINGOS E FERIADOS)",44593523000245.0,CONTABILIDADE4@SAMARITANOSAUDE.COM.BR,3999,1.0,1.0,1.0,1.0,1,1,,NAO,140
2023474,3524702023474,35,352470,46410866000171.0,PREFEITURA MUNICIPAL DE JAGUARIUNA,HOSPITAL MUNICIPAL WALTER FERRARI,,,M,,,M ,MUNICIPAL,3,5,13911112,RUA AMAZONAS,8,DOM BOSCO,(19) 38671122,-22.70224,-46.99531,6,"ATENDIMENTO CONTINUO DE 24 HORAS/DIA (PLANTAO:INCLUI SABADOS, DOMINGOS E FERIADOS)",,uac.saude@jaguariuna.sp.gov.br,1244,1.0,1.0,1.0,1.0,1,1,,SIM,68
2023512,3509502023512,35,350950,,HOSPITAL SANTA SOFIA LTDA,HOSPITAL SANTA SOFIA,,,M,,,M ,MUNICIPAL,4,5,13013161,AV ANDRADE NEVES,611,BOTAFOGO,19 3737-8000,-22.90324577,-47.0698447,6,"ATENDIMENTO CONTINUO DE 24 HORAS/DIA (PLANTAO:INCLUI SABADOS, DOMINGOS E FERIADOS)",46012944000180.0,hss@hospitalsantasofia.com.br,2062,1.0,0.0,0.0,1.0,1,1,,NAO,32
2023644,3512802023644,35,351280,,HOSPITAL BENEFICENTE SANTA GERTRUDES,HOSPITAL BENEFICENTE SANTA GERTRUDES,,,M,,,M ,MUNICIPAL,4,5,13150000,RUA MAX HERGERT,978,CENTRO,19 3812-8300,-22.64934367,-47.19672918,6,"ATENDIMENTO CONTINUO DE 24 HORAS/DIA (PLANTAO:INCLUI SABADOS, DOMINGOS E FERIADOS)",47368675000151.0,,3999,1.0,0.0,0.0,1.0,1,1,10.0,SIM,0
2023709,3523402023709,35,352340,,SANTA CASA DE MISERICORDIA DE ITATIBA,SANTA CASA DE MISERICORDIA DE ITATIBA,,,M,,,M ,MUNICIPAL,4,5,13253000,AVENIDA DA SAUDADE,43,CENTRO,(11)4894-8899,-23.007161,-46.833107,6,"ATENDIMENTO CONTINUO DE 24 HORAS/DIA (PLANTAO:INCLUI SABADOS, DOMINGOS E FERIADOS)",50119585000131.0,santacasa@itatiba.sp.gov.br,3999,1.0,1.0,1.0,1.0,1,1,,SIM,90
2023865,3524202023865,35,352420,52382702000180.0,PREFEITURA MUNICIPAL DE JABORANDI,HOSPITAL MUNICIPAL DR AMADEU PAGLIUSO,,,M,,,M ,MUNICIPAL,4,5,14775013,RUA DR AMADEU PAGLIUSO,480,CENTRO,(17)33471286,-20.6895328,-48.416615,6,"ATENDIMENTO CONTINUO DE 24 HORAS/DIA (PLANTAO:INCLUI SABADOS, DOMINGOS E FERIADOS)",,,1244,1.0,0.0,1.0,1.0,1,1,,SIM,9
2024438,3531102024438,35,353110,46578506000183.0,PREFEITURA MUNICIPAL DA ESTANCIA BALNEARIA DE MONGAGUA,HOSPITAL E MATERNIDADE DRA ADONIRAN CORREIA CAMPOS MONGAGUA,,,M,,,M ,MUNICIPAL,4,5,11730004,AVENIDA SAO PAULO,826,VILA SAO PAULO,(13)35056060,-24.09081383,-46.61332911,6,"ATENDIMENTO CONTINUO DE 24 HORAS/DIA (PLANTAO:INCLUI SABADOS, DOMINGOS E FERIADOS)",,,1244,1.0,1.0,1.0,1.0,1,1,,SIM,18
2024624,3504002024624,35,350400,,HOSPITAL E MATERNIDADE DE ASSIS S A,HOSPITAL E MATERNIDADE DE ASSIS,,,M,,,M ,MUNICIPAL,4,5,19814970,RUA ANA ANGELA RAZABONI DE ANDRADE,405,JAD PAULISTA,18 3302-1700,-22.66011599,-50.39943695,6,"ATENDIMENTO CONTINUO DE 24 HORAS/DIA (PLANTAO:INCLUI SABADOS, DOMINGOS E FERIADOS)",44367845000195.0,autorizador@hmassis.com.br,2054,1.0,1.0,1.0,1.0,1,1,,NAO,55
2024632,3526902024632,35,352690,50480953000172.0,UNIMED DE LIMEIRA COOPERATIVA DE TRABALHO MEDICO,HOSPITAL UNIMED LIMEIRA,,,M,,,M ,MUNICIPAL,4,5,13480041,RUA SANTA CRUZ,620,CENTRO,(19) 3404 4800,-22.56286572,-47.40324316,6,"ATENDIMENTO CONTINUO DE 24 HORAS/DIA (PLANTAO:INCLUI SABADOS, DOMINGOS E FERIADOS)",50480953000253.0,admhospital@unimedlimeira.com.br,2143,1.0,1.0,1.0,1.0,1,1,,NAO,70
2024691,3513402024691,35,351340,,SANTA CASA DE MISERICORDIA DE CRUZEIRO,SANTA CASA DE CRUZEIRO,,,M,,,M ,MUNICIPAL,4,5,12701330,MAJOR NOVAES,715,CENTRO,(12)3184-7005,-22.57531065,-44.96455193,6,"ATENDIMENTO CONTINUO DE 24 HORAS/DIA (PLANTAO:INCLUI SABADOS, DOMINGOS E FERIADOS)",47431697000119.0,,3999,1.0,1.0,1.0,1.0,1,1,,SIM,111
2024756,3508502024756,35,350850,,FUSAM FUNDACAO DE SAUDE E ASSIST DO MUNIC DE CACAPAVA,HOSPITAL E MATERNIDADE NOSSA SENHORA DA AJUDA,,,M,,,M ,MUNICIPAL,4,5,12281450,DOUTOR PEREIRA DE MATTOS,63,CENTRO,12 36548800,-23.1039275,-45.7050478,6,"ATENDIMENTO CONTINUO DE 24 HORAS/DIA (PLANTAO:INCLUI SABADOS, DOMINGOS E FERIADOS)",50453703000143.0,contabilidade@fusam.com.br,3069,1.0,1.0,1.0,1.0,1,1,,SIM,58
2024772,3508602024772,35,350860,,ASSOCIACAO BENEF SAO JOSE E SANTA CASA DE MISERICORDIA SAO J,SANTA CASA DE MISERICORDIA SAO JOSE,,,M,,,M ,MUNICIPAL,4,5,12630000,SETE DE SETEMBRO,122,CENTRO,,-22.66592754,-45.00626564,6,"ATENDIMENTO CONTINUO DE 24 HORAS/DIA (PLANTAO:INCLUI SABADOS, DOMINGOS E FERIADOS)",45889623000103.0,,3999,0.0,0.0,0.0,0.0,1,1,,SIM,31
