CO_CNES,CO_UNIDADE,CO_UF,CO_IBGE,NU_CNPJ_MANTENEDORA,NO_RAZAO_SOCIAL,NO_FANTASIA,CO_NATUREZA_ORGANIZACAO,DS_NATUREZA_ORGANIZACAO,TP_GESTAO,CO_NIVEL_HIERARQUIA,DS_NIVEL_HIERARQUIA,CO_ESFERA_ADMINISTRATIVA,DS_ESFERA_ADMINISTRATIVA,CO_ATIVIDADE,TP_UNIDADE,CO_CEP,NO_LOGRADOURO,NU_ENDERECO,NO_BAIRRO,NU_TELEFONE,NU_LATITUDE,NU_LONGITUDE,CO_TURNO_ATENDIMENTO,DS_TURNO_ATENDIMENTO,NU_CNPJ,NO_EMAIL,CO_NATUREZA_JUR,ST_CENTRO_CIRURGICO,ST_CENTRO_OBSTETRICO,ST_CENTRO_NEONATAL,ST_ATEND_HOSPITALAR,ST_SERVICO_APOIO,ST_ATEND_AMBULATORIAL,CO_MOTIVO_DESAB,CO_AMBULATORIAL_SUS,leitos
2079208,3530802079208,35,353080,,ASSOCIACAO ESPIRITA JESUS E CARIDADE,LAR ESPIRITA MARIA DE NAZARE MOJI MIRIM,,,E,,,E ,ESTADUAL,4,5,13806305,AVN NELSON PATELLI,79,PARQUE DA IMPRENSA,19 3862-1448,-22.430404,-46.970932,6,"ATENDIMENTO CONTINUO DE 24 HORAS/DIA (PLANTAO:INCLUI SABADOS, DOMINGOS E FERIADOS)",52780673000377.0,larmariadenazare1@gmail.com,3999,0.0,0.0,0.0,0.0,1,1,,NAO,0
2079216,3511002079216,35,351100,,SOCIEDADE BENEFICENTE DE CASTILHO,HOSPITAL E MATERNIDADE JOSE FORTUNA,,,M,,,M ,MUNICIPAL,4,5,16920017,RUA NAGIB MUHANA ZAHR,457,CENTRO,1837411580,-20.87233613,-51.48727972,6,"ATENDIMENTO CONTINUO DE 24 HORAS/DIA (PLANTAO:INCLUI SABADOS, DOMINGOS E FERIADOS)",51103562000100.0,admhosp@sbcastilho.com.br,3069,1.0,1.0,1.0,1.0,1,1,,SIM,28
2079224,3522902079224,35,352290,46189726000115.0,MUNICIPIO DE ITAPUI,HOSPITAL SAO JOSE,,,M,,,M ,MUNICIPAL,4,5,17230023,AVENIDA PAES DE BARROS,336,CENTRO,14 36648040,-22.23492314,-48.72181177,6,"ATENDIMENTO CONTINUO DE 24 HORAS/DIA (PLANTAO:INCLUI SABADOS, DOMINGOS E FERIADOS)",,assesoriasaude@itapui.sp.gov.br,1244,1.0,0.0,0.0,1.0,1,1,,SIM,25
2079232,3545802079232,35,354580,,SANTA CASA DE MISERICORDIA DE SANTA BARBARA DOESTE,HOSPITAL SANTA BARBARA,,,M,,,M ,MUNICIPAL,4,5,13450033,RUA JOAO LINO,914,CENTRO,(19)34991855,-22.7541796,-47.4192112,6,"ATENDIMENTO CONTINUO DE 24 HORAS/DIA (PLANTAO:INCLUI SABADOS, DOMINGOS E FERIADOS)",56725385000109.0,hosbadm@dglnet.com.br,3999,1.0,1.0,1.0,1.0,1,1,,SIM,103
2079240,3550302079240,35,355030,46374500000194.0,SECRETARIA DE ESTADO DA SAUDE DE SAO PAULO,HOSPITAL GERAL JESUS TEIXEIRA DA COSTA GUAIANASES SAO PAULO,,,E,,,E ,ESTADUAL,4,5,8461110,AV MIGUEL ACHIOLE DA FONSECA,135,JARDIM SAO PAULO,(11) 2557-6972,-23.55665085,-46.40025368,6,"ATENDIMENTO CONTINUO DE 24 HORAS/DIA (PLANTAO:INCLUI SABADOS, DOMINGOS E FERIADOS)",46374500010904.0,eulalaia.moriyama@oss.santamarcelina.org,1023,1.0,1.0,1.0,1.0,1,1,,SIM,148
2079275,3543402079275,35,354340,,HAPVIDA ASSISTENCIA MEDICA S A,HOSPITAL RIBEIRAO PRETO,,,M,,,M ,MUNICIPAL,3,5,14015130,BERNARDINO DE CAMPOS,912,CENTRO,85 40023633,-21.18495735,-47.80897672,6,"ATENDIMENTO CONTINUO DE 24 HORAS/DIA (PLANTAO:INCLUI SABADOS, DOMINGOS E FERIADOS)",63554067041030.0,FISCAL@HAPVIDA.COM.BR,2054,1.0,0.0,0.0,1.0,1,1,,NAO,161
2079283,3535402079283,35,353540,,SANTA CASA E MATERNIDADE DE PANORAMA,SANTA CASA DE PANORAMA,,,M,,,M ,MUNICIPAL,4,5,17980000,RUA MANOEL FERNANDES DA CUNHA,512,CENTRO,(18)38711583,-21.3621836,-51.8593993,6,"ATENDIMENTO CONTINUO DE 24 HORAS/DIA (PLANTAO:INCLUI SABADOS, DOMINGOS E FERIADOS)",44880110000160.0,santacasaenfermagem@hotmail.com,3999,1.0,0.0,0.0,1.0,1,1,10.0,SIM,0
2079291,3535202079291,35,353520,,IRMANDADE DA SANTA CASA DE MIS DE PALMEIRA DOESTE,SANTA CASA DE PALMEIRA DOESTE,,,M,,,M ,MUNICIPAL,4,5,15720003,AV CARLOS GOMES,4929,CENTRO,(17)36511432/1122,-20.41796379,-50.76205552,6,"ATENDIMENTO CONTINUO DE 24 HORAS/DIA (PLANTAO:INCLUI SABADOS, DOMINGOS E FERIADOS)",50570753000100.0,scpalmeiradoeste@hotmail.com,3999,1.0,1.0,1.0,1.0,1,1,,SIM,16
2079313,3508402079313,35,350840,,SANTA CASA DE MISERICORDIA DE CABREUVA,HOSPITAL SAO ROQUE CABREUVA,,,M,,,M ,MUNICIPAL,4,5,13315035,PRC COMENDADOR MARTINS,S/N,CENTRO,(11)4528-1792,-23.312674,-47.133658,6,"ATENDIMENTO CONTINUO DE 24 HORAS/DIA (PLANTAO:INCLUI SABADOS, DOMINGOS E FERIADOS)",45721180000139.0,administracao@santacasacabreuva.com.br,3999,1.0,1.0,0.0,1.0,1,1,,SIM,8
2079348,3520102079348,35,352010,,IRMANDADE DA SANTA CASA DE MISERICORDIA DE IGARAPAVA,SANTA CASA DE IGARAPAVA,,,M,,,M ,MUNICIPAL,4,5,14540000,CEL FRANCISCO MARTINS,769,CENTRO,16 31721090,-20.035966,-47.749532,6,"ATENDIMENTO CONTINUO DE 24 HORAS/DIA (PLANTAO:INCLUI SABADOS, DOMINGOS E FERIADOS)",49376858000144.0,faturamento@scig.com.br,3999,1.0,1.0,1.0,1.0,1,1,,SIM,39
2079356,3553402079356,35,355340,,SANTA CASA SAO VICENTE DE PAULO DE TANABI,SANTA CASA DE TANABI,,,E,,,E ,ESTADUAL,4,5,15170071,AVN DA SAUDADE,634,CENTRO,(17) 32729130,-20.627975,-49.652153,6,"ATENDIMENTO CONTINUO DE 24 HORAS/DIA (PLANTAO:INCLUI SABADOS, DOMINGOS E FERIADOS)",72079114000180.0,administracao@santacasadetanabi.org.br,3999,1.0,1.0,1.0,1.0,1,1,,SIM,49
2079364,3551502079364,35,355150,,SOCIEDADE BENEFICENTE HOSP STA CASA DE MISERICORDIA SERRANA,SANTA CASA DE MISERICORDIA DE SERRANA,,,M,,,M ,MUNICIPAL,3,5,14150000,RUA JOAO ANTONIO TERCARIOL,S/N,CENTRO,(16)39879700,-21.21229271,-47.59937979,6,"ATENDIMENTO CONTINUO DE 24 HORAS/DIA (PLANTAO:INCLUI SABADOS, DOMINGOS E FERIADOS)",71305635000145.0,coordenacao.enfermagem@santacasaserrana.com.br,3999,1.0,1.0,1.0,1.0,1,1,,SIM,14
2079372,3556502079372,35,355650,,AMEC ASSISTENCIA MEDICO CIRURGICA SC LTDA,AMEC ASSISTENCIA MEDICO CIRURGICA,,,M,,,M ,MUNICIPAL,4,5,13224270,AVN EDUARDO DE CASTRO,65,VIL SAO JOSE,(11)46061328,,,6,"ATENDIMENTO CONTINUO DE 24 HORAS/DIA (PLANTAO:INCLUI SABADOS, DOMINGOS E FERIADOS)",49433808000151.0,hospitalamec@uol.com.br,2000,1.0,1.0,1.0,1.0,1,1,4.0,SIM,0
2079380,3545002079380,35,354500,,SANTA CASA DE MISERICORDIA FREDERICO OZANAN,SANTA CASA DE SALESOPOLIS,,,M,,,M ,MUNICIPAL,4,5,8970000,PRC PADRE JOAO MENENDES,31,CENTRO,(11)46961411,-23.53231,-45.84583,6,"ATENDIMENTO CONTINUO DE 24 HORAS/DIA (PLANTAO:INCLUI SABADOS, DOMINGOS E FERIADOS)",58484239000164.0,stacasa_sale@hotmail.com,3999,0.0,0.0,0.0,0.0,1,1,,SIM,9
2079399,3552702079399,35,355270,,SANTA CASA DE MISERICORDIA SAO MIGUEL,SANTA CASA DE MISERICORDIA SAO MIGUEL TABATINGA SP,,,M,,,M ,MUNICIPAL,4,5,14910614,RUA CATANDUVA,206,VILA ROSSINI,(16)33851911,-21.73820552,-48.68544453,6,"ATENDIMENTO CONTINUO DE 24 HORAS/DIA (PLANTAO:INCLUI SABADOS, DOMINGOS E FERIADOS)",71991087000154.0,scasatabatinga@uol.com.br,3999,1.0,1.0,1.0,1.0,1,1,,SIM,23
2079402,3506702079402,35,350670,,SANTA CASA DE MISERICORDIA SAO VICENTE DE PAULO,SANTA CASA SAO VICENTE DE PAULO BOA ESPERANCA DO SUL,,,M,,,M ,MUNICIPAL,4,5,14930000,DUQUE DE CAXIAS,379,CENTRO,,-21.9876366,-48.38683605,6,"ATENDIMENTO CONTINUO DE 24 HORAS/DIA (PLANTAO:INCLUI SABADOS, DOMINGOS E FERIADOS)",43974666000153.0,fat.santacasabes@gmail.com,3999,1.0,1.0,0.0,1.0,1,1,,SIM,16
2079410,3518802079410,35,351880,46374500000194.0,SECRETARIA DE ESTADO DA SAUDE DE SAO PAULO,COMPLEXO HOSPITALAR PADRE BENTO DE GUARULHOS,,,E,,,E ,ESTADUAL,3,5,7051000,AV EMILIO RIBAS,1819,GOPOUVA,(11) 2463-5650,-23.46565585,-46.55023336,6,"ATENDIMENTO CONTINUO DE 24 HORAS/DIA (PLANTAO:INCLUI SABADOS, DOMINGOS E FERIADOS)",46374500012877.0,chpbg-diretoria@saude.sp.gov.br,1023,1.0,0.0,0.0,1.0,1,1,,SIM,150
2079429,3545302079429,35,354530,,ASSOCIACAO DA SANTA CASA DE MISERICORDIA DE SALTO DE PIRAPOR,SANTA CASA SALTO DE PIRAPORA,,,M,,,M ,MUNICIPAL,4,5,18160067,CARLOS CHAGAS,67,CENTRO,,-23.6443472,-47.5720968,6,"ATENDIMENTO CONTINUO DE 24 HORAS/DIA (PLANTAO:INCLUI SABADOS, DOMINGOS E FERIADOS)",50807833000137.0,,3999,1.0,0.0,0.0,1.0,1,1,,SIM,43
2079437,3528802079437,35,352880,,ASSOCIACAO HOSPITAL BENEFICENTE DE MARACAI,HOSPITAL BENEFICENTE DE MARACAI,,,M,,,M ,MUNICIPAL,4,5,19840037,AVN JOSE BONIFACIO,382,CENTRO,(18) 3371-2797,-22.612347,-50.66643476,6,"ATENDIMENTO CONTINUO DE 24 HORAS/DIA (PLANTAO:INCLUI SABADOS, DOMINGOS E FERIADOS)",48368989000117.0,provedoria@ahbm.com.br,3999,1.0,0.0,1.0,1.0,1,1,,SIM,17
2079445,3550302079445,35,355030,,HOSPITAL SANTA ISABEL,HOSPITAL SANTA ISABEL,,,M,,,M ,MUNICIPAL,4,5,1238010,R DONA VERIDIANA,311,VILA BUARQUE,(11)2176-1422,-23.54267468,-46.65078163,6,"ATENDIMENTO CONTINUO DE 24 HORAS/DIA (PLANTAO:INCLUI SABADOS, DOMINGOS E FERIADOS)",62779145003962.0,silvio.cardenuto@hsi.org.br,3999,1.0,0.0,0.0,1.0,0,1,,NAO,78
2079461,3508102079461,35,350810,,SANTA CASA DE MISERICORDIA SAO FRANCISCO BURITAMA,SANTA CASA DE MISERICORDIA SAO FRANCISCO BURITAMA,,,M,,,M ,MUNICIPAL,4,5,15290000,RUA GUILHERME GUERBAS,353,CENTRO,(18)3691-9535,-21.066,-50.147,6,"ATENDIMENTO CONTINUO DE 24 HORAS/DIA (PLANTAO:INCLUI SABADOS, DOMINGOS E FERIADOS)",44435451000127.0,santacasa@santacasaburitama.com.br,3999,1.0,1.0,1.0,1.0,1,1,,SIM,22
2079496,3513102079496,35,351310,,SOCIEDADE BENEFICENTE DE CRAVINHOS SANTA CASA,SANTA CASA DE CRAVINHOS,,,M,,,M ,MUNICIPAL,4,5,14140000,AV DONA RITA CANDIDA NOGUEIRA,38,CENTRO,(16)39519020,-21.33661109,-47.73272038,6,"ATENDIMENTO CONTINUO DE 24 HORAS/DIA (PLANTAO:INCLUI SABADOS, DOMINGOS E FERIADOS)",47404801000186.0,adm@santacasacravinhos.com.br,3999,1.0,1.0,1.0,1.0,1,1,,SIM,15
2079518,3513602079518,35,351360,,ASSOCIACAO BENEFICENTE NOSSA SENHORA DA CONCEICAO,SANTA CASA DE MIS E MATERNIDADE N SRA DA CONCEICAO CUNHA,,,M,,,M ,MUNICIPAL,4,5,12530000,AVENIDA PADRE RODOLFO,320,ALTO DO CRUZEIRO,(12)31111122,-23.06551806,-44.96686935,6,"ATENDIMENTO CONTINUO DE 24 HORAS/DIA (PLANTAO:INCLUI SABADOS, DOMINGOS E FERIADOS)",47531835000131.0,contato@santacasacunha.org.br,3999,1.0,1.0,0.0,1.0,1,1,,SIM,31
2079550,3545602079550,35,354560,,IRMANDADE DA SANTA CASA DE MISERICORDIA DE SANTA ADELIA,SANTA CASA DE SANTA ADELIA,,,M,,,M ,MUNICIPAL,4,5,15950025,AV DUQUE DE CAXIAS,168,CENTRO,(17)35712233,-21.24602234,-48.80805016,6,"ATENDIMENTO CONTINUO DE 24 HORAS/DIA (PLANTAO:INCLUI SABADOS, DOMINGOS E FERIADOS)",49021348000154.0,stacasastaadelia@uol.com.br,3999,1.0,0.0,0.0,1.0,1,1,,SIM,20
2079569,3509702079569,35,350970,,FUNDACAO SAO PAULO APOSTOLO,HOSPITAL SAO PAULO,,,M,,,M ,MUNICIPAL,4,5,12460000,RUA VER AGRIPINO LOPES DE MORAIS,1100,VILA MATILDE,(12)3668-9010,,,6,"ATENDIMENTO CONTINUO DE 24 HORAS/DIA (PLANTAO:INCLUI SABADOS, DOMINGOS E FERIADOS)",46746319000161.0,hospsaopaulo@fhsp.com.br,3069,1.0,1.0,0.0,1.0,1,1,4.0,SIM,0
2079585,3509702079585,35,350970,,INSTITUTO DAS FILHAS DE NOSSA SENHORA DAS GRACAS,CASA DA CRIANCA HOSPITAL INFANTIL CAMPOS DO JORDAO,,,E,,,E ,ESTADUAL,4,5,12460000,RUA MONSENHOR JOSE VITA,321,ABERNESSIA,(12)36622233,,,6,"ATENDIMENTO CONTINUO DE 24 HORAS/DIA (PLANTAO:INCLUI SABADOS, DOMINGOS E FERIADOS)",46750162000148.0,faturamento.hcc@terra.com.br,3000,0.0,0.0,0.0,0.0,1,1,4.0,NAO,0
2079593,3542602079593,35,354260,,ASSOC DE PROT E ASSIT A MATERNIDADE E A INFANCIA DE REGISTRO,HOSPITAL SAO JOAO REGISTRO,,,E,,,E ,ESTADUAL,4,5,11900000,RUA KIHEIJI NASUNO,165,CENTRO,(13)38216099,-24.48705057,-47.84652531,6,"ATENDIMENTO CONTINUO DE 24 HORAS/DIA (PLANTAO:INCLUI SABADOS, DOMINGOS E FERIADOS)",55856710000100.0,hsj@hospitalsaojoao.com.br,3999,1.0,1.0,0.0,1.0,1,1,,SIM,72
2079607,3547802079607,35,354780,,HOSPITAL E MATERNIDADE DR CHRISTOVAO DA GAMA S A,HOSPITAL E MATERNIDADE DR CHRISTOVAO DA GAMA,,,M,,,M ,MUNICIPAL,4,5,9030010,AV DOUTOR ERASMO,18,VILA ASSUNCAO,(11)49933805,-23.6813488,-46.5531917,6,"ATENDIMENTO CONTINUO DE 24 HORAS/DIA (PLANTAO:INCLUI SABADOS, DOMINGOS E FERIADOS)",57482903000173.0,jose.lima@hmcg.com.br,2054,1.0,0.0,1.0,1.0,1,1,,NAO,98
2079615,3519702079615,35,351970,46634531000137.0,PREFEITURA MUNICIPAL DE IBIUNA,HOSPITAL MUNICIPAL DE IBIUNA IBIUNA SP,,,M,,,M ,MUNICIPAL,4,5,18150000,AV DR GABRIEL MONTEIRO DA SILVA,888,CENTRO,015 3248-9520,-23.650953,-47.2181791,6,"ATENDIMENTO CONTINUO DE 24 HORAS/DIA (PLANTAO:INCLUI SABADOS, DOMINGOS E FERIADOS)",,faturahm@gmail.com,1244,1.0,1.0,0.0,1.0,1,1,,SIM,45
2079666,3509502079666,35,350950,,FUNDACAO CENTRO MEDICO DE CAMPINAS,CENTRO MEDICO DE CAMPINAS,,,M,,,M ,MUNICIPAL,4,5,13083190,RUA DR EDILBERTO LUIZ PEREIRA DA SILVA,929,CIDADE UNIVERSITARIA,19 - 3789-5400,-22.80875,-47.06529,6,"ATENDIMENTO CONTINUO DE 24 HORAS/DIA (PLANTAO:INCLUI SABADOS, DOMINGOS E FERIADOS)",44595700000141.0,centro.medico@fcmc.com.br,3069,1.0,0.0,1.0,1.0,1,1,,NAO,200
2079674,3534702079674,35,353470,,UROCLINICA DE OURINHOS LTDA,CENTRO MEDICO MONTE SINAI OURINHOS,,,M,,,M ,MUNICIPAL,4,5,19900043,RUA EUCLIDES DA CUNHA,1111,CENTRO,14 33222922,-22.98672,-49.864935,6,"ATENDIMENTO CONTINUO DE 24 HORAS/DIA (PLANTAO:INCLUI SABADOS, DOMINGOS E FERIADOS)",54712872000101.0,,2062,1.0,0.0,0.0,1.0,1,1,,NAO,4
2079682,3532502079682,35,353250,,IRMANDADE DA SANTA CASA DE MISERICORDIA NEVES PAULISTA,SANTA CASA DE NEVES PAULISTA,,,M,,,M ,MUNICIPAL,4,5,15120019,RUA FLORIANO PEIXOTO,95,CENTRO,(17) 3271 1297,-20.84595833,-49.63181019,6,"ATENDIMENTO CONTINUO DE 24 HORAS/DIA (PLANTAO:INCLUI SABADOS, DOMINGOS E FERIADOS)",45145208000137.0,santacasaneves@hotmail.com,3999,0.0,0.0,0.0,0.0,1,1,,SIM,21
2079690,3550002079690,35,355000,,SANTA CASA DE MISERICORDIA DE SAO LUIZ DO PARAITINGA,SANTA CASA DE MISERICORDIA DE SAO LUIZ DO PARAITINGA,,,M,,,M ,MUNICIPAL,4,5,12140000,PRC CEL TEODORO COELHO,48,CENTRO,(12)3671129,-23.22535514,-45.30763865,6,"ATENDIMENTO CONTINUO DE 24 HORAS/DIA (PLANTAO:INCLUI SABADOS, DOMINGOS E FERIADOS)",60315462000120.0,faturamento@santacasamisericordiaslp.com.br,3999,0.0,1.0,0.0,1.0,1,1,,SIM,16
2079704,3552102079704,35,355210,,IRMANDADE DA SANTA CASA DE MISERICORDIA DE SOCORRO,HOSPITAL DR RENATO SILVA DE SOCORRO,,,M,,,M ,MUNICIPAL,4,5,13960000,DR RENATO SILVA,129,CENTRO,,-22.59852,-46.5296166,6,"ATENDIMENTO CONTINUO DE 24 HORAS/DIA (PLANTAO:INCLUI SABADOS, DOMINGOS E FERIADOS)",71408546000124.0,,3999,1.0,1.0,1.0,1.0,1,1,,SIM,50
2079720,3548502079720,35,354850,46374500000194.0,SECRETARIA DE ESTADO DA SAUDE DE SAO PAULO,HOSPITAL GUILHERME ALVARO SANTOS,,,E,,,E ,ESTADUAL,5,5,11045904,RUA OSWALDO CRUZ,197,BOQUEIRAO,(13) 3202-1300,-23.96276185,-46.32053963,6,"ATENDIMENTO CONTINUO DE 24 HORAS/DIA (PLANTAO:INCLUI SABADOS, DOMINGOS E FERIADOS)",46374500001670.0,hga-dirtecnica@saude.sp.gov.br,1023,1.0,1.0,1.0,1.0,1,1,,SIM,190
2079739,3554102079739,35,355410,,IRMANDADE DE MISERICORDIA DE TAUBATE,HOSPITAL SANTA ISABEL DE CLINICAS DE TAUBATE,,,E,,,E ,ESTADUAL,4,5,12030180,AVM TIRADENTES,280,CENTRO,(12)2259200,,,6,"ATENDIMENTO CONTINUO DE 24 HORAS/DIA (PLANTAO:INCLUI SABADOS, DOMINGOS E FERIADOS)",72293392000135.0,,3000,1.0,1.0,0.0,1.0,1,1,4.0,NAO,0
2079755,3535902079755,35,353590,,HOSPITAL SANTO ANTONIO LTDA,HOSPITAL SANTO ANTONIO PARANAPUA,,,E,,,E ,ESTADUAL,4,5,15745000,AVN BARAO DE SERRA NEGRA,2333,CENTRO,(17)6481166,,,6,"ATENDIMENTO CONTINUO DE 24 HORAS/DIA (PLANTAO:INCLUI SABADOS, DOMINGOS E FERIADOS)",71748032000118.0,,2000,1.0,0.0,1.0,1.0,1,1,1.0,NAO,0
2079798,3509502079798,35,350950,46068425000133.0,UNIVERSIDADE ESTADUAL DE CAMPINAS,HOSPITAL DAS CLINICAS DA UNICAMP DE CAMPINAS,,,E,,,E ,ESTADUAL,5,5,13024500,RUA VITAL BRASIL,251,BARAO GERALDO,(19)37888008,-22.90596526,-47.06392765,6,"ATENDIMENTO CONTINUO DE 24 HORAS/DIA (PLANTAO:INCLUI SABADOS, DOMINGOS E FERIADOS)",,shc@hc.unicamp.br,1112,1.0,1.0,1.0,1.0,1,1,,SIM,507
2079801,3546002079801,35,354600,,SANTA CASA SAO JOAQUIM,SANTA CASA DE SANTA BRANCA,,,E,,,E ,ESTADUAL,3,5,12380000,PRACA RUI BARBOSA,109,CENTRO,(12)39724400,,,6,"ATENDIMENTO CONTINUO DE 24 HORAS/DIA (PLANTAO:INCLUI SABADOS, DOMINGOS E FERIADOS)",56777063000103.0,provedoriasantacasa@yahoo.com.br,3000,1.0,1.0,1.0,1.0,1,1,4.0,NAO,0
2079828,3552802079828,35,355280,46374500000194.0,SECRETARIA DE ESTADO DA SAUDE,HOSPITAL GERAL PIRAJUSSARA,,,E,,,E ,ESTADUAL,4,5,6785300,IBIRAMA,1214,TABOAO DA SERRA,011 35839502,-23.64066375,-46.81004964,6,"ATENDIMENTO CONTINUO DE 24 HORAS/DIA (PLANTAO:INCLUI SABADOS, DOMINGOS E FERIADOS)",46374500013415.0,hgp@hgp.spdm.org.br,1023,1.0,1.0,1.0,1.0,1,1,,SIM,214
2079836,3522702079836,35,352270,,ASSOC SANTA CASA MISERICORDIA E MATERNIDADE D JULIETA LYRA,SANTA CASA DE MISERICORDIA ITAPOLIS,,,M,,,M ,MUNICIPAL,4,5,14900089,RUA ANTONIO COMPAGNO,411,CENTRO,(16)3263-9500,-21.5938655,-48.8052164,6,"ATENDIMENTO CONTINUO DE 24 HORAS/DIA (PLANTAO:INCLUI SABADOS, DOMINGOS E FERIADOS)",49979230000133.0,administracao@santacasaitapolis.com.br,3999,1.0,1.0,0.0,1.0,1,1,,SIM,79
2079852,3538602079852,35,353860,,IRMANDADE DA SANTA CASA DE MISERICORDIA SAO VICENTE DE PAULO,SANTA CASA DE PIRACAIA,,,M,,,M ,MUNICIPAL,4,5,12970000,AV DR CANDIDO RODRIGUES,36,CENTRO,(11)40367965,-23.0553575,-46.3569139,6,"ATENDIMENTO CONTINUO DE 24 HORAS/DIA (PLANTAO:INCLUI SABADOS, DOMINGOS E FERIADOS)",54344833000107.0,stacasapiracaia@ig.com.br,3999,1.0,0.0,1.0,1.0,1,1,,SIM,34
2079860,3552502079860,35,355250,,INSTITUTO NACIONAL DE TECNOLOGIA E SAUDE,HOSPITAL E MATERNIDADE DE SUZANO,,,M,,,M ,MUNICIPAL,4,5,8676420,AVENIDA ANTONIO MARQUES FIGUEIRA,1861,VILA FIGUEIRA,11 47453333,-23.552027,-46.3096171,6,"ATENDIMENTO CONTINUO DE 24 HORAS/DIA (PLANTAO:INCLUI SABADOS, DOMINGOS E FERIADOS)",11344038003709.0,FISCAL@INTS.ORG.BR,3999,1.0,1.0,1.0,1.0,1,1,,SIM,68
2079879,3553802079879,35,355380,,SANTA CASA DE MISERICORDIA DE TAQUARITUBA,SANTA CASA DE TAQUARITUBA,,,M,,,M ,MUNICIPAL,4,5,18740013,MAL FLORIANO PEIXOTO,95,CENTRO,1437621700,-23.53946817,-49.24510002,6,"ATENDIMENTO CONTINUO DE 24 HORAS/DIA (PLANTAO:INCLUI SABADOS, DOMINGOS E FERIADOS)",45437175000107.0,santacasataquarituba@yahoo.com.br,3999,1.0,1.0,1.0,1.0,1,1,,SIM,37
2079887,3534402079887,35,353440,,NOTRE DAME INTERMEDICA SAUDE S A,HOSPITAL CRUZEIRO DO SUL,,,M,,,M ,MUNICIPAL,4,5,6090010,AVENIDA DOS AUTONOMISTAS,2502,CENTRO,(11)36069000,-23.5375286,-46.7769294,6,"ATENDIMENTO CONTINUO DE 24 HORAS/DIA (PLANTAO:INCLUI SABADOS, DOMINGOS E FERIADOS)",44649812026013.0,nairo.junior@hapvida.com.br,2054,1.0,1.0,1.0,1.0,1,1,,NAO,84
2079895,3524802079895,35,352480,,SANTA CASA DE MISERICORDIA DE JALES,SANTA CASA DE MISERICORDIA DE JALES,,,E,,,E ,ESTADUAL,3,5,15700082,AVN JOAO AMADEU,2049,CENTRO,(17)36225000,-20.270908,-50.552628,6,"ATENDIMENTO CONTINUO DE 24 HORAS/DIA (PLANTAO:INCLUI SABADOS, DOMINGOS E FERIADOS)",50565936000138.0,alex.trindade@santacasajales.com.br,3999,1.0,1.0,1.0,1.0,1,1,,SIM,124
2079909,3539002079909,35,353900,,ASSOCIACAO BENEFICENTE DE PIRANGI,HOSP BENEFICENTE DE PIRANGI,,,M,,,M ,MUNICIPAL,4,5,15820280,CARMEM LUCIA GIGLIO GIRADE,1901,JARDIM TANGARA,17 33861800,-21.0886,-48.6607,6,"ATENDIMENTO CONTINUO DE 24 HORAS/DIA (PLANTAO:INCLUI SABADOS, DOMINGOS E FERIADOS)",51804771000172.0,hbpirangi@gmail.com,3999,1.0,1.0,0.0,1.0,1,1,,SIM,27
2079917,3527302079917,35,352730,,IRMANDADE DA SANTA CASA DE LOUVEIRA,SANTA CASA DE LOUVEIRA,,,M,,,M ,MUNICIPAL,4,5,13293010,ARTHUR DE SOUZA SYGEL,500,JARDIM VERA CRUZ,19 39485151,-23.086778,-46.946444,6,"ATENDIMENTO CONTINUO DE 24 HORAS/DIA (PLANTAO:INCLUI SABADOS, DOMINGOS E FERIADOS)",46959862000147.0,ORG_CONT@TERRA.COM.BR,3999,1.0,1.0,1.0,1.0,1,1,,SIM,24
2079925,3540602079925,35,354060,,IRMANDADE DA SANTA CASA DE MISERICORDIA DE PORTO FELIZ,SANTA CASA DE PORTO FELIZ,,,M,,,M ,MUNICIPAL,4,5,18542152,RUA OLAVO ASSUMPCAO FLEURY,101,JARDIM SANTA ROSA,(15)32618800,-23.20442,-47.52471,6,"ATENDIMENTO CONTINUO DE 24 HORAS/DIA (PLANTAO:INCLUI SABADOS, DOMINGOS E FERIADOS)",55141725000191.0,sac@santacasaportofeliz.org.br,3999,1.0,1.0,1.0,1.0,1,1,,SIM,76
2079968,3555802079968,35,355580,,IRMANDADE DA SANTA CASA DE MISERICORDIA DE URANIA,SANTA CASA DE URANIA,,,M,,,M ,MUNICIPAL,4,5,15761060,RUA DA GLORIA,218,CENTRO,1736341299,-20.252354,-50.642893,6,"ATENDIMENTO CONTINUO DE 24 HORAS/DIA (PLANTAO:INCLUI SABADOS, DOMINGOS E FERIADOS)",51845782000109.0,santacasadeurania@yahoo.com,3999,1.0,1.0,0.0,1.0,1,1,,SIM,26
2079976,3526402079976,35,352640,,IRMANDADE DA SANTA CASA DE MISERICORDIA DE LARANJAL PTA,SANTA CASA DE LARANJAL PAULISTA,,,M,,,M ,MUNICIPAL,4,5,18500340,RUA GOV PEDRO DE TOLEDO,633,CENTRO,(15)33839191,-23.0553504,-47.83247709,6,"ATENDIMENTO CONTINUO DE 24 HORAS/DIA (PLANTAO:INCLUI SABADOS, DOMINGOS E FERIADOS)",51332658000131.0,scasa@lonline.com.br,3999,1.0,1.0,1.0,1.0,1,1,,SIM,28
2080001,3552802080001,35,355280,,NOTRE DAME INTERMEDICA SAUDE S A,NOTRE DAME INTERMEDICA SAUDE S A,,,M,,,M ,MUNICIPAL,4,5,6754090,RUA JOAO SANTUCCI,250,VILA SANTA LUZIA,(11) 4788-7073,-23.60568021,-46.7505103,4,"ATENDIMENTO NOS TURNOS DA MANHA, TARDE E NOITE",44649812022883.0,lucilia.freire@intermedica.com.br,2054,1.0,1.0,1.0,1.0,1,1,,NAO,49
2080028,3513802080028,35,351380,46523247000193.0,PREFEITURA DO MUNICIPIO DE DIADEMA,HOSPITAL MUNICIPAL DE DIADEMA HMD,,,M,,,M ,MUNICIPAL,4,5,9950000,AV PIRAPORINHA,1682,PIRAPORINHA,(11)40617000,-23.69189725,-46.58716401,6,"ATENDIMENTO CONTINUO DE 24 HORAS/DIA (PLANTAO:INCLUI SABADOS, DOMINGOS E FERIADOS)",,hospital.municipal@diadema.sp.gov.br,1244,1.0,1.0,1.0,1.0,1,1,,SIM,192
2080036,3557102080036,35,355710,,HOSPITAL SANTA CATARINA LTDA,HOSPITAL SANTA CATARINA VOTUPORANGA,,,E,,,E ,ESTADUAL,3,5,15505171,RUA SANTA CATARINA,510,CENTRO,(17)04213055,,,6,"ATENDIMENTO CONTINUO DE 24 HORAS/DIA (PLANTAO:INCLUI SABADOS, DOMINGOS E FERIADOS)",72950751000180.0,,2000,1.0,1.0,1.0,1.0,1,1,4.0,NAO,0
2080044,3549402080044,35,354940,,SANTA CASA DE MISERICORDIA DE SAO JOAQUIM DA BARRA,SANTA CASA DE SAO JOAQUIM DA BARRA,,,E,,,E ,ESTADUAL,4,5,14600073,RUA PIRATININGA,1221,CENTRO,(16)3810-4000,-20.59020587,-47.85914898,6,"ATENDIMENTO CONTINUO DE 24 HORAS/DIA (PLANTAO:INCLUI SABADOS, DOMINGOS E FERIADOS)",59849182000112.0,jadestro@netsite.com.br,3999,1.0,1.0,1.0,1.0,1,1,,SIM,89
2080052,3530602080052,35,353060,,SANTA CASA DE MISERICORDIA DE MOGI DAS CRUZES,HOSPITAL NOSSA SENHORA APARECIDA,,,M,,,M ,MUNICIPAL,4,5,8780906,RUA BARAO DE JACEGUAI,1148,CENTRO,4728-4700,-23.52135878,-46.18671656,6,"ATENDIMENTO CONTINUO DE 24 HORAS/DIA (PLANTAO:INCLUI SABADOS, DOMINGOS E FERIADOS)",52543766000116.0,cnes@santacasamc.com.br,3999,1.0,1.0,1.0,1.0,1,1,,SIM,129
2080060,3545702080060,35,354570,,CARNEIRO CARNEIRO ASSUNCAO LTDA,HOSPITAL SANTA TEREZA SANTA ALBERTINA,,,E,,,E ,ESTADUAL,4,5,15750000,RUA PEDRO PRUDENTE DE MORAES,861,CENTRO,(17)36331122,,,6,"ATENDIMENTO CONTINUO DE 24 HORAS/DIA (PLANTAO:INCLUI SABADOS, DOMINGOS E FERIADOS)",49675762000187.0,vileleassuncao@ig.com.br,2000,1.0,1.0,1.0,1.0,1,1,1.0,NAO,0
2080079,3515702080079,35,351570,46374500000194.0,SECRETARIA DE ESTADO DA SAUDE,HOSPITAL DR OSIRIS FLORINDO COELHO,,,E,,,E ,ESTADUAL,4,5,8502200,PRINCESA ISABEL,270,VILA CORREA,,-23.5384242,-46.35846374,6,"ATENDIMENTO CONTINUO DE 24 HORAS/DIA (PLANTAO:INCLUI SABADOS, DOMINGOS E FERIADOS)",46374500012443.0,rh-hrfv@saude.sp.gov.br,1023,1.0,1.0,1.0,1.0,1,1,,SIM,189
2080087,3554502080087,35,355450,,SANTA CASA DE MISERICORDIA DE TIETE,SANTA CASA DE MISERICORDIA DE TIETE,,,M,,,M ,MUNICIPAL,4,5,18530071,RUA TENENTE GELAS,1035,CENTRO,1532859444,-23.1065512,-47.7134504,6,"ATENDIMENTO CONTINUO DE 24 HORAS/DIA (PLANTAO:INCLUI SABADOS, DOMINGOS E FERIADOS)",72457716000123.0,provedoria@santacasatiete.com.br,3999,1.0,1.0,1.0,1.0,1,1,,SIM,37
2080095,3525702080095,35,352570,,SANTA CASA DE MISERICORDIA DE JOSE BONIFACIO,SANTA CASA DE JOSE BONIFACIO,,,E,,,E ,ESTADUAL,4,5,15200000,RUA QUINZE DE NOVEMBRO,S/N,BELA VISTA,(17)32659022,-21.055687,-49.69373,6,"ATENDIMENTO CONTINUO DE 24 HORAS/DIA (PLANTAO:INCLUI SABADOS, DOMINGOS E FERIADOS)",50857960000140.0,faturamento@santacasajosebonifacio.com.br,3999,1.0,1.0,1.0,1.0,1,1,,SIM,44
2080109,3540402080109,35,354040,,IRMANDADE DA SANTA CASA DE MISERICORDIA DE POPULINA,SANTA CASA DE POPULINA,,,M,,,M ,MUNICIPAL,4,5,15670035,RUA TREZE DE MAIO,1099,CENTRO,(17)36391170,-19.94234902,-50.53874016,6,"ATENDIMENTO CONTINUO DE 24 HORAS/DIA (PLANTAO:INCLUI SABADOS, DOMINGOS E FERIADOS)",65713471000192.0,santacasapopulina@gmail.com,3999,1.0,1.0,1.0,1.0,1,1,,SIM,16
2080133,3547802080133,35,354780,,SOCIEDADE PORTUGUESA DE BENEFICENCIA DE SANTO ANDRE,HOSPITAL E MATERNIDADE BENEFICENCIA PORTUGUESA,,,M,,,M ,MUNICIPAL,4,5,9040000,AVENIDA PORTUGAL,530,CENTRO,(11)21985000,-23.66021392,-46.53258741,6,"ATENDIMENTO CONTINUO DE 24 HORAS/DIA (PLANTAO:INCLUI SABADOS, DOMINGOS E FERIADOS)",57507402000102.0,beneficencia@beneficenciasantoandre.com.br,3999,1.0,1.0,1.0,1.0,1,1,,NAO,95
2080141,3503702080141,35,350370,,ASSOCIACAO BENEFICENTE JULIA RUETE,HOSPITAL JULIA RUETE ARIRANHA,,,M,,,M ,MUNICIPAL,4,5,15960000,RUA SIQUEIRA CAMPOS,29,CENTRO,(17)35769370,-21.188,-48.787,6,"ATENDIMENTO CONTINUO DE 24 HORAS/DIA (PLANTAO:INCLUI SABADOS, DOMINGOS E FERIADOS)",56365356000183.0,hospital8@hotmail.com,3999,1.0,1.0,1.0,1.0,1,1,10.0,SIM,0
2080176,3550302080176,35,355030,,HOSPITAL E MATERNIDADE CASA VERDE LTDA,HOSP MAT CASA VERDE,,,M,,,M ,MUNICIPAL,4,5,2517001,RUA RELIQUIA,716,CASA VERDE,(11)39668555,,,6,"ATENDIMENTO CONTINUO DE 24 HORAS/DIA (PLANTAO:INCLUI SABADOS, DOMINGOS E FERIADOS)",61431862000163.0,hmcv@ig.com.br,2062,1.0,0.0,1.0,1.0,1,1,4.0,NAO,0
2080184,3523902080184,35,352390,46634440000100.0,MUNICIPIO DE ITU,HOSPITAL MUNICIPAL,,,M,,,M ,MUNICIPAL,4,5,13309060,RUA CONVENCAO,550,VILA NOVA,,-23.27268624,-47.29141168,6,"ATENDIMENTO CONTINUO DE 24 HORAS/DIA (PLANTAO:INCLUI SABADOS, DOMINGOS E FERIADOS)",,,1244,1.0,0.0,0.0,1.0,1,1,,SIM,28
2080206,3523402080206,35,352340,,HOSPITAL ITATIBA LTDA,HOSPITAL ITATIBA,,,M,,,M ,MUNICIPAL,4,5,13252901,RODOVIA DAS ESTANCIAS,S/N,PONTE,(11) 3408-7000,-22.96527199,-46.82379637,6,"ATENDIMENTO CONTINUO DE 24 HORAS/DIA (PLANTAO:INCLUI SABADOS, DOMINGOS E FERIADOS)",2290842000150.0,diretoria@hospitalitatiba.com.br,2062,1.0,1.0,1.0,1.0,1,1,,SIM,16
2080222,3508702080222,35,350870,,IRMANDADE SANTA CASA DE MISERICORDIA DE CACONDE,SANTA CASA DE CACONDE,,,E,,,E ,ESTADUAL,4,5,13770160,RUA PADRE DE ANGELIS,39,CENTRO,19 3662-1711,-21.5331955,-46.6471279,6,"ATENDIMENTO CONTINUO DE 24 HORAS/DIA (PLANTAO:INCLUI SABADOS, DOMINGOS E FERIADOS)",45915675000107.0,hospital@santacasacaconde.com.br,3999,1.0,0.0,0.0,1.0,1,1,,SIM,21
2080257,3550302080257,35,355030,,HOSPITAL E MATERNIDADE SANTA MARINA LTDA,SANTA MARINA HOSPITAL GERAL E MATERNIDADE,,,M,,,M ,MUNICIPAL,4,5,4378500,AV SANTA CATARINA,2775,VIL SANTA CATARINA,(11)55635000,,,6,"ATENDIMENTO CONTINUO DE 24 HORAS/DIA (PLANTAO:INCLUI SABADOS, DOMINGOS E FERIADOS)",62747688000125.0,custos@hospitalsantamarina.com,2062,1.0,1.0,1.0,1.0,1,1,4.0,SIM,0
