CO_CNES,CO_UNIDADE,CO_UF,CO_IBGE,NU_CNPJ_MANTENEDORA,NO_RAZAO_SOCIAL,NO_FANTASIA,CO_NATUREZA_ORGANIZACAO,DS_NATUREZA_ORGANIZACAO,TP_GESTAO,CO_NIVEL_HIERARQUIA,DS_NIVEL_HIERARQUIA,CO_ESFERA_ADMINISTRATIVA,DS_ESFERA_ADMINISTRATIVA,CO_ATIVIDADE,TP_UNIDADE,CO_CEP,NO_LOGRADOURO,NU_ENDERECO,NO_BAIRRO,NU_TELEFONE,NU_LATITUDE,NU_LONGITUDE,CO_TURNO_ATENDIMENTO,DS_TURNO_ATENDIMENTO,NU_CNPJ,NO_EMAIL,CO_NATUREZA_JUR,ST_CENTRO_CIRURGICO,ST_CENTRO_OBSTETRICO,ST_CENTRO_NEONATAL,ST_ATEND_HOSPITALAR,ST_SERVICO_APOIO,ST_ATEND_AMBULATORIAL,CO_MOTIVO_DESAB,CO_AMBULATORIAL_SUS,leitos
3039420,3550303039420,35,355030,,SOCIEDADE BENEFICENTE SAO CAMILO,HOSPITAL SAO CAMILO SANTANA,,,M,,,M ,MUNICIPAL,4,5,2406040,DOUTOR LUIS LUSTOSA DA SILVA,33,SANTANA,11 36750035,-23.48751504,-46.62691325,6,"ATENDIMENTO CONTINUO DE 24 HORAS/DIA (PLANTAO:INCLUI SABADOS, DOMINGOS E FERIADOS)",60975737001204.0,eliezer.soares@hospitalsaocamilosp.org.br,3999,1.0,1.0,1.0,1.0,1,1,,NAO,228
3042529,3549903042529,35,354990,,POLICLIN S A SERVICOS MEDICOS HOSPITALARES,HOSPITAL POLICLIN,,,M,,,M ,MUNICIPAL,4,5,12243001,AVENIDA NOVE DE JULHO,430,VILA ADYANNA,12 37979800,-23.1956647,-45.8937347,6,"ATENDIMENTO CONTINUO DE 24 HORAS/DIA (PLANTAO:INCLUI SABADOS, DOMINGOS E FERIADOS)",45184066000117.0,natashocoelho.hp9julho@policlin.com.br,2054,1.0,0.0,0.0,1.0,1,1,,NAO,91
3044831,3508503044831,35,350850,,POLICLIN S A SERVICOS MEDICO HOSPITALARES,HOSPITAL POLICLIN CACAPAVA,,,M,,,M ,MUNICIPAL,4,5,12281350,CEL JOAO DIAS GUIMARAES,266,CENTRO,12 32211000,-23.101,-45.707,6,"ATENDIMENTO CONTINUO DE 24 HORAS/DIA (PLANTAO:INCLUI SABADOS, DOMINGOS E FERIADOS)",45184066000206.0,dr.fredericomarcondes@policlin.com.br,2054,1.0,1.0,0.0,1.0,1,1,,SIM,11
3045625,3550303045625,35,355030,,HOSPITAL E MATERNIDADE VIDAS LTDA,HOSP MAT VIDAS,,,M,,,M ,MUNICIPAL,4,5,4685006,NSRA DE SABARA,2375,VILA SANTANA,11 33219450,-23.67506222,-46.68564011,6,"ATENDIMENTO CONTINUO DE 24 HORAS/DIA (PLANTAO:INCLUI SABADOS, DOMINGOS E FERIADOS)",96534300000120.0,CONTABILIDADE@HOSPITALVIDAS.COM.BR,2062,0.0,1.0,1.0,1.0,1,1,,NAO,38
3047822,3548703047822,35,354870,,HOSPITAL SAO BERNARDO S A,HOSPITAL SAO BERNARDO S A,,,M,,,M ,MUNICIPAL,4,5,9750660,LUCAS NOGUEIRA GARCEZ,400,JARDIM DO MAR,41225600,-23.690249,-46.55421,6,"ATENDIMENTO CONTINUO DE 24 HORAS/DIA (PLANTAO:INCLUI SABADOS, DOMINGOS E FERIADOS)",59105692000185.0,fernando.leal@intermedica.com.br,2054,1.0,0.0,0.0,1.0,1,1,10.0,NAO,0
3058808,3506103058808,35,350610,46374500000194.0,SECRETARIA DE ESTADO DA SAUDE,HOSPITAL REGIONAL DE BEBEDOURO HRB,,,E,,,E ,ESTADUAL,4,5,14701690,AVENIDA JOSE CUTRALE JUNIOR,4001,JARDIM CRUZEIRO DO S,1733449600,-20.9477504,-48.4960376,6,"ATENDIMENTO CONTINUO DE 24 HORAS/DIA (PLANTAO:INCLUI SABADOS, DOMINGOS E FERIADOS)",46374500028951.0,habebedouro.gestao@hospitaldeamor.com.br,1023,1.0,1.0,1.0,1.0,1,1,,SIM,78
3060616,3527103060616,35,352710,,HAPVIDA ASSISTENCIA MEDICA S A,HOSPITAL LINS,,,M,,,M ,MUNICIPAL,4,5,16401371,AV NICOLAU ZARVOS,1650,JARDIM AEROPORTO,(014) 3533-4401,-21.6690834,-49.7379332,6,"ATENDIMENTO CONTINUO DE 24 HORAS/DIA (PLANTAO:INCLUI SABADOS, DOMINGOS E FERIADOS)",63554067040815.0,gleice.angelis@hapvida.com.br,2054,1.0,1.0,1.0,1.0,1,1,,NAO,13
3071448,3547303071448,35,354730,46522983000127.0,PREFEITURA MUNICIPAL DE SANTANA DE PARNAIBA,HOSPITAL DE RETAGUARDA FERNAO DIAS,,,M,,,M ,MUNICIPAL,4,5,6530040,RUA IBIRAPUERA,155,PARQUE FERNAO DIAS,,-23.4580055,-46.9310121,4,"ATENDIMENTO NOS TURNOS DA MANHA, TARDE E NOITE",,,1244,0.0,0.0,0.0,0.0,1,1,,SIM,20
3101126,3513003101126,35,351300,,HOSPITAL SAO FRANCISCO EIRELE,HOSPITAL SAO FRANCISCO SC LTDA,,,M,,,M ,MUNICIPAL,4,5,6717100,AV PROF MANOEL JOSE PEDROSO,701,VILA SAO FRANCISCO D,1146156677,-23.60665775,-46.92094532,6,"ATENDIMENTO CONTINUO DE 24 HORAS/DIA (PLANTAO:INCLUI SABADOS, DOMINGOS E FERIADOS)",65705444000178.0,hosp.saofrancisco@uol.com.br,2062,1.0,1.0,1.0,1.0,1,1,,NAO,232
3105571,3549903105571,35,354990,,BRX ESTETICLIN HOSPITAL ESPECIALIZADO LTDA,HOSPITAL ESPLANADA,,,M,,,M ,MUNICIPAL,4,5,12242840,AVENIDA SAO JOAO,1522,JARDIM ESPLANADA,(12)3922-7711,-23.2012965,-45.9053369,3,ATENDIMENTOS NOS TURNOS DA MANHA E A TARDE,60127198000109.0,FINANCEIRO.HOSPITALESPLANADA@GMAIL.COM,2240,0.0,0.0,0.0,0.0,1,1,,NAO,2
3109216,3509503109216,35,350950,,CAMPINAS DAY HOSPITAL SC LTDA,CAMPINAS DAY HOSPITAL,,,M,,,M ,MUNICIPAL,4,5,13025005,AV BENJAMIN CONSTANT,1991,CAMBUI,(19) 2127-2900,-22.900105,-47.053169,6,"ATENDIMENTO CONTINUO DE 24 HORAS/DIA (PLANTAO:INCLUI SABADOS, DOMINGOS E FERIADOS)",2965843000158.0,cdh@cdh.com.br,2240,1.0,0.0,0.0,1.0,1,1,,NAO,1
3126838,3554103126838,35,355410,,SOCIEDADE BENEFICENTE SAO CAMILO,HOSPITAL REGIONAL DO VALE DO PARAIBA,,,E,,,E ,ESTADUAL,3,5,12030180,AV TIRADENTES,280,CENTRO,(12)36342000,-23.03596,-45.554337,6,"ATENDIMENTO CONTINUO DE 24 HORAS/DIA (PLANTAO:INCLUI SABADOS, DOMINGOS E FERIADOS)",60975737007245.0,,3999,1.0,0.0,0.0,1.0,1,1,,SIM,237
3137163,3506103137163,35,350610,,UNIMED DE BEBEDOURO COOPERATIVA DE TRABALHO MEDICO,HOSPITAL UNIMED SAMARITANO,,,M,,,M ,MUNICIPAL,4,5,14701310,RUA VISCONDE DO RIO BRANCO,45,CENTRO,(17)33441500,-20.94623,-48.486614,6,"ATENDIMENTO CONTINUO DE 24 HORAS/DIA (PLANTAO:INCLUI SABADOS, DOMINGOS E FERIADOS)",60633369000597.0,secretariahospital@unimedbebedouro.coop.br.,2143,1.0,0.0,0.0,1.0,1,1,,NAO,18
3137171,3506103137171,35,350610,,UNIMED DE BEBEDOURO COOPERATIVA DE TRABALHO MEDICO,HOSPITAL UNIMED UNIDADE II,,,M,,,M ,MUNICIPAL,4,5,14700010,PRACA ABILIO ALVES MARQUES,134,CENTRO,(17) 3345-9400,-20.949917,-48.477365,6,"ATENDIMENTO CONTINUO DE 24 HORAS/DIA (PLANTAO:INCLUI SABADOS, DOMINGOS E FERIADOS)",60633369000678.0,secretaria.unidade2 @unimedbeb,2143,1.0,0.0,0.0,1.0,1,0,,NAO,14
3139050,3522303139050,35,352230,,BENEFICENCIA NIPO BRASILEIRA DE SAO PAULO,HOSPITAL DR LEO ORSI BERNARDES ITAPETININGA,,,M,,,M ,MUNICIPAL,4,5,18200220,RUA PADRE ALBUQUERQUE,245,CENTRO,(15) 3275-7800,-23.58463487,-48.04510921,6,"ATENDIMENTO CONTINUO DE 24 HORAS/DIA (PLANTAO:INCLUI SABADOS, DOMINGOS E FERIADOS)",60992427002270.0,diretoria@saocamiloitapetininga.com.br,3999,1.0,1.0,1.0,1.0,1,1,,SIM,160
3142531,3505503142531,35,350550,,HOSPITAL SAO JORGE LTDA,HOSPITAL SAO JORGE,,,M,,,M ,MUNICIPAL,4,5,14780390,RUA 32 ESQUINA 35,176,BARONI,(17)33215050,-20.5556725,-48.57810974,6,"ATENDIMENTO CONTINUO DE 24 HORAS/DIA (PLANTAO:INCLUI SABADOS, DOMINGOS E FERIADOS)",44788172000147.0,,2062,1.0,1.0,1.0,1.0,1,1,,NAO,38
3166597,3550303166597,35,355030,,INSTITUICAO PAULISTA ADVENTISTA DE EDUC E ASS SOCIAL,HOSPITAL ADVENTISTA DE SAO PAULO,,,M,,,M ,MUNICIPAL,3,5,1525010,RUA ROCHA POMBO,49,LIBERDADE,11-2838-7000,-23.563483,-46.633919,6,"ATENDIMENTO CONTINUO DE 24 HORAS/DIA (PLANTAO:INCLUI SABADOS, DOMINGOS E FERIADOS)",43586122000971.0,ATENDIMENTO.JURIDICO@HASP.ORG.BR,3999,1.0,0.0,0.0,1.0,1,1,,NAO,17
3199770,3549903199770,35,354990,,UNIMED SAO JOSE DOS CAMPOS COOPERATIVA DE TRABALHO MEDICO,SANTOS DUMONT PRONTO ATENDIMENTO UNIDADE VILACA,,,M,,,M ,MUNICIPAL,4,5,12210000,RUA VILACA,820,CENTRO,(12)39460399,-23.18524116,-45.88103055,6,"ATENDIMENTO CONTINUO DE 24 HORAS/DIA (PLANTAO:INCLUI SABADOS, DOMINGOS E FERIADOS)",60214517000962.0,"diretoria@unimedsjc.com.br, danielrgf@gmail.com",2143,1.0,0.0,0.0,1.0,1,1,,NAO,0
3212130,3550303212130,35,355030,46392130000380.0,PREFEITURA DO MUNICIPIO DE SAO PAULO,HOSP MUN VER JOSE STOROPOLLI,,,M,,,M ,MUNICIPAL,3,5,2181160,RUA FRANCISCO FANGANIELLO,127,PARQUE NOVO MUNDO,11 22079000,-23.52217787,-46.56327335,6,"ATENDIMENTO CONTINUO DE 24 HORAS/DIA (PLANTAO:INCLUI SABADOS, DOMINGOS E FERIADOS)",46392148003801.0,superintendencia@hmvjs.spdm.org.br,1031,1.0,1.0,1.0,1.0,1,1,,SIM,160
3223728,3548703223728,35,354870,,IRMANDADE SANTA CASA DE MISERICORDIA DE SAO BERNARDO CAMPO,SANTA CASA DE MISERICORDIA DE SAO BERNARDO DO CAMPO,,,M,,,M ,MUNICIPAL,4,5,9860214,AV ROBERT KENNEDY,2900,ASSUNCAO,(11)4353-3300,-23.71595544,-46.57426357,6,"ATENDIMENTO CONTINUO DE 24 HORAS/DIA (PLANTAO:INCLUI SABADOS, DOMINGOS E FERIADOS)",47708771000100.0,faturamento@santacasasbc.org.br,3999,1.0,0.0,0.0,1.0,1,1,,SIM,14
3259463,3550303259463,35,355030,,PREVENT LABOR ATENDIMENTO CLINICO E HOSPITALAR LTDA,HOSP STA MAGGIORE ANALIA FRANCO,,,M,,,M ,MUNICIPAL,4,5,1333000,RUA JOSE DE OSCAR DE ABREU SAMPAIO,376,JARDIM ANALIA FRANCO,(11)66726111,,,6,"ATENDIMENTO CONTINUO DE 24 HORAS/DIA (PLANTAO:INCLUI SABADOS, DOMINGOS E FERIADOS)",3504916000177.0,hsmaf@ajato.com.br,2062,1.0,0.0,0.0,1.0,1,1,10.0,NAO,0
3272591,3505703272591,35,350570,,HOSPITALIS NUCLEO HOSPITALAR DE BARUERI LTDA,HOSPITALIS,,,M,,,M ,MUNICIPAL,4,5,6411150,RUA CAMPOS SALES,1160,BOA VISTA,(11)3883-3322,-23.50290945,-46.8780456,6,"ATENDIMENTO CONTINUO DE 24 HORAS/DIA (PLANTAO:INCLUI SABADOS, DOMINGOS E FERIADOS)",59042622000125.0,hospitalis@hospitalis.com.br,2062,1.0,0.0,1.0,1.0,1,1,,SIM,74
3309959,3550303309959,35,355030,,NOTRE DAME INTERMEDICA SAUDE S A,HOSPITAL BOSQUE DA SAUDE,,,M,,,M ,MUNICIPAL,4,5,4142082,AV BOSQUE DA SAUDE,1926,SAUDE,55917505,-23.61328767,-46.62030779,6,"ATENDIMENTO CONTINUO DE 24 HORAS/DIA (PLANTAO:INCLUI SABADOS, DOMINGOS E FERIADOS)",44649812023006.0,luciana.costa@intermedica.com.br,2054,1.0,0.0,0.0,1.0,1,1,,NAO,111
3314596,3550303314596,35,355030,,HOSPITAL E MATERNIDADE TALITA LTDA,HOSPITAL TALITA,,,M,,,M ,MUNICIPAL,4,5,3978270,RUA LUIS JULIANI,67,VILA RENATO,(11)61039111,,,6,"ATENDIMENTO CONTINUO DE 24 HORAS/DIA (PLANTAO:INCLUI SABADOS, DOMINGOS E FERIADOS)",54935614000194.0,,2240,1.0,1.0,1.0,1.0,1,0,4.0,NAO,0
3314766,3543403314766,35,354340,,ASSOCIACAO DE ENSINO DE RIBEIRAO PRETO,HOSPITAL ELECTRO BONINI RIBEIRAO PRETO,,,M,,,M ,MUNICIPAL,1,5,14096900,AVENIDA COSTABILE ROMANO,2201,RIBEIRANIA,(16)36037897,-21.2031169,-47.7796662,6,"ATENDIMENTO CONTINUO DE 24 HORAS/DIA (PLANTAO:INCLUI SABADOS, DOMINGOS E FERIADOS)",55983670000167.0,ceceb@unaerp.br,3999,1.0,1.0,1.0,1.0,1,1,,SIM,11
3334678,3510403334678,35,351040,59499251000105.0,UNIMED DE CAPIVARI COOPERATIVA DE TRABALHO MEDICO,HOSPITAL UNIMED DE CAPIVARI,,,M,,,M ,MUNICIPAL,4,5,13360021,RUA REGENTE FEIJO,778,CENTRO,(19) 3491-9777,-22.99483446,-47.50295699,6,"ATENDIMENTO CONTINUO DE 24 HORAS/DIA (PLANTAO:INCLUI SABADOS, DOMINGOS E FERIADOS)",59499251000296.0,gerencia.huc@unimedcapivari.com.br,2143,1.0,0.0,1.0,1.0,1,1,,NAO,38
3366219,3502803366219,35,350280,,UNIMED DE ARACATUBA COOPERATIVA DE TRABALHO MEDICO,HOSPITAL UNIMED DE ARACATUBA,,,M,,,M ,MUNICIPAL,4,5,16013800,GASPAR LEMOS,2,PANORAMA,18 36361300,-21.2305644,-50.4169753,6,"ATENDIMENTO CONTINUO DE 24 HORAS/DIA (PLANTAO:INCLUI SABADOS, DOMINGOS E FERIADOS)",51093193000456.0,,2143,1.0,0.0,1.0,1.0,1,1,,NAO,67
3367371,3550303367371,35,355030,,AMICO SAUDE LTDA,HOSPITAL DA LUZ 113,,,M,,,M ,MUNICIPAL,4,5,4013060,RUA AZEVEDO DE MACEDO,113,JARDIM ZAIRA,(11) 2117-6000,-23.58113,-46.64037,6,"ATENDIMENTO CONTINUO DE 24 HORAS/DIA (PLANTAO:INCLUI SABADOS, DOMINGOS E FERIADOS)",51722957000506.0,keli.almeida@hospitaldaluz.com.br,2054,1.0,0.0,0.0,1.0,1,1,,NAO,122
3441520,3502803441520,35,350280,8859629000101.0,CLINIMED DAY HOSPITAL LTDA EPP,HOSPITAL SANTA MARIA,,,M,,,M ,MUNICIPAL,4,5,16010330,RUA OSCAR RODRIGUES ALVES,2,CENTRO,(18) 3607-6000,,,6,"ATENDIMENTO CONTINUO DE 24 HORAS/DIA (PLANTAO:INCLUI SABADOS, DOMINGOS E FERIADOS)",2426135000149.0,admhsantamaria@gmail.com,2062,1.0,0.0,0.0,1.0,1,1,1.0,NAO,0
3451720,3550303451720,35,355030,,GODOI ADMINISTRADORA E CONSULTORIA DE SERVICOS LTDA,HOSP GERAL GODOI,,,M,,,M ,MUNICIPAL,4,5,1232011,R CONSELHEIRO BROTERO,999,HIGIENOPOLIS,(11)38255000,,,6,"ATENDIMENTO CONTINUO DE 24 HORAS/DIA (PLANTAO:INCLUI SABADOS, DOMINGOS E FERIADOS)",2501839000139.0,,2240,0.0,0.0,0.0,0.0,1,1,4.0,NAO,0
3461963,3518803461963,35,351880,,CASA DE SAUDE GUARULHOS LTDA,HOSPITAL CASA DE SAUDE GUARULHOS,,,M,,,M ,MUNICIPAL,4,5,7022000,RUA DONA ANTONIA,636,GOPOUVA,1124083555,,,6,"ATENDIMENTO CONTINUO DE 24 HORAS/DIA (PLANTAO:INCLUI SABADOS, DOMINGOS E FERIADOS)",44266229000148.0,gerencia.enfermagem@hotmail.com,2062,1.0,0.0,0.0,1.0,1,1,10.0,NAO,0
3464555,3550303464555,35,355030,,POLICIA MILITAR DO ESTADO DE SAO PAULO,CENTRO MEDICO PMESP,,,M,,,M ,MUNICIPAL,4,5,2341001,AVENIDA NOVA CANTAREIRA,3659,TREMEMBE,(11) 2109-3755,-23.469156,-46.618354,6,"ATENDIMENTO CONTINUO DE 24 HORAS/DIA (PLANTAO:INCLUI SABADOS, DOMINGOS E FERIADOS)",4198514002602.0,cmedasstecnica@policiamilitar.sp.gov.br,1023,1.0,0.0,0.0,1.0,1,1,,NAO,95
3477355,3550303477355,35,355030,,PREMIER RESIDENCE HOSPITAL S A,PREMIER RESIDENCE HOSPITAL,,,M,,,M ,MUNICIPAL,4,5,4583100,RUA JURUBATUBA,461,VILA CORDEIRO,21 99999-5888,-23.7151989,-46.5524483,6,"ATENDIMENTO CONTINUO DE 24 HORAS/DIA (PLANTAO:INCLUI SABADOS, DOMINGOS E FERIADOS)",7028113000144.0,marcelle.pires@premierhospital.com.br,2054,0.0,0.0,0.0,0.0,1,0,,NAO,74
3482146,3519603482146,35,351960,,HOSPITAL IBITINGA LTDA,HI HOSPITAL IBITINGA,,,M,,,M ,MUNICIPAL,4,5,14940181,R PEREIRA LANDIM,514,CENTRO,16 33414070,-21.75483632,-48.82684708,6,"ATENDIMENTO CONTINUO DE 24 HORAS/DIA (PLANTAO:INCLUI SABADOS, DOMINGOS E FERIADOS)",5595597000188.0,halianca@ig.com.br,2062,1.0,1.0,1.0,1.0,1,1,,NAO,0
3483096,3550303483096,35,355030,,SAHA SERVICOS MEDICOS E HOSPITALARES LTDA,SAHA SERVICOS MEDICOS E HOSPITALARES,,,M,,,M ,MUNICIPAL,4,5,1323000,MAESTRO CARDIM,407,BELA VISTA,(11) 2162-7100,-23.56434407,-46.64104995,4,"ATENDIMENTO NOS TURNOS DA MANHA, TARDE E NOITE",7045325000130.0,,2062,1.0,0.0,0.0,1.0,1,1,,NAO,10
3486346,3543403486346,35,354340,,HOSPITAL ESPECIALIZADO DE RIBEIRAO PRETO LTDA,HERP,,,M,,,M ,MUNICIPAL,4,5,14026160,AV INDEPENDENCIA,4000,JARDIM CALIFORNIA,(16)39130004,-21.184835,-47.8043276,6,"ATENDIMENTO CONTINUO DE 24 HORAS/DIA (PLANTAO:INCLUI SABADOS, DOMINGOS E FERIADOS)",6053916000196.0,marina.adm@herpnet.com.br,2062,1.0,0.0,0.0,1.0,1,1,10.0,NAO,0
3507157,3549903507157,35,354990,50459239000100.0,VIVALLE SERVICOS DE SAUDE LTDA,HOSPITAL VIVALLE,,,M,,,M ,MUNICIPAL,4,5,12244380,AVENIDA LINEU DE MOURA,995,URBANOVA,012 39244900,,,6,"ATENDIMENTO CONTINUO DE 24 HORAS/DIA (PLANTAO:INCLUI SABADOS, DOMINGOS E FERIADOS)",50459239000283.0,sac@vivalle.com.br,2000,1.0,0.0,0.0,1.0,1,1,4.0,NAO,0
3517918,3549903517918,35,354990,,HAPVIDA ASSISTENCIA MEDICA S A,HOSPITAL SAO JOSE,,,M,,,M ,MUNICIPAL,4,5,12245280,AVENIDA HEITOR VILLA LOBOS,2071,JARDIM SAO DIMAS,(12)3924-2000,-23.2061945,-45.885373,6,"ATENDIMENTO CONTINUO DE 24 HORAS/DIA (PLANTAO:INCLUI SABADOS, DOMINGOS E FERIADOS)",63554067030267.0,t.gustavo.rossaa@hapvida.com.br,2054,1.0,1.0,1.0,1.0,1,1,8.0,NAO,0
3518949,3527103518949,35,352710,,UNIMED DE LINS COOPERATIVA DE TRABALHO MEDICO,HOSPITAL UNIMED LINS,,,M,,,M ,MUNICIPAL,4,5,16400472,LUIZ GAMA,1677,JARDIM ARAPUA,(014) 3533-4835,-21.68235,-49.759544,6,"ATENDIMENTO CONTINUO DE 24 HORAS/DIA (PLANTAO:INCLUI SABADOS, DOMINGOS E FERIADOS)",71695746000377.0,almirrufato@unimedlins.com.br,2143,1.0,0.0,0.0,1.0,1,1,,NAO,35
3528596,3547803528596,35,354780,,HOSPITAL SANTA HELENA SOCIEDADE ANONIMA,HOSPITAL SANTA HELENA SANTO ANDRE,,,M,,,M ,MUNICIPAL,4,5,9015410,MANOEL VAZ,3559,VILA ALZIRA,11 49727155,-23.66773311,-46.52031869,4,"ATENDIMENTO NOS TURNOS DA MANHA, TARDE E NOITE",6033403000113.0,LEGALIZACAOBR@AMIL.COM.BR,2054,1.0,0.0,0.0,1.0,1,1,,NAO,110
3529282,3549803529282,35,354980,46588950000180.0,PREFEITURA MUNICIPAL DE SAO JOSE DO RIO PRETO,HOSPITAL MUNICIPAL DOMINGO MARCOLINO BRAILE FUNFARME,,,M,,,M ,MUNICIPAL,4,5,15041215,AVENIDA JOSE RODRIGUES LISBOA,201,JARDIM ATLANTICA,(17) 3206-2500,-20.78976,-49.4155,6,"ATENDIMENTO CONTINUO DE 24 HORAS/DIA (PLANTAO:INCLUI SABADOS, DOMINGOS E FERIADOS)",,,1244,1.0,0.0,0.0,1.0,1,1,,SIM,63
3536890,3538003536890,35,353800,,HOSPITAL PINDAMONHANGABA SC LTDA,HOSPITAL PINDA,,,M,,,M ,MUNICIPAL,4,5,12421090,AV ARISTIDES JOAQUIM DE OLIVEIRA,115,SOCORRO,(12)36432599,,,6,"ATENDIMENTO CONTINUO DE 24 HORAS/DIA (PLANTAO:INCLUI SABADOS, DOMINGOS E FERIADOS)",45224532000140.0,,2000,1.0,1.0,0.0,1.0,1,1,4.0,NAO,0
3539113,3550603539113,35,355060,50795566000125.0,BANCO DE OLHOS DE SOROCABA,HOSPITAL DE SAO ROQUE,,,M,,,M ,MUNICIPAL,4,5,18130565,RUA SANTA ISABEL,186,CENTRO,(11)47135400,,,6,"ATENDIMENTO CONTINUO DE 24 HORAS/DIA (PLANTAO:INCLUI SABADOS, DOMINGOS E FERIADOS)",50795566000559.0,administracao@hospitalsaoroque,3000,1.0,1.0,1.0,1.0,1,1,4.0,SIM,0
3556352,3550303556352,35,355030,96291141008598.0,SECRETARIA DA ADMINISTRACAO PENITENCIARIA,CENTRO DE ATENDIMENTO HOSPITALAR A MULHER PRESA,,,M,,,M ,MUNICIPAL,4,5,5577300,ROD RAPOSO TAVARES,S/N,JD ARPOADOR,(13)7854740,,,6,"ATENDIMENTO CONTINUO DE 24 HORAS/DIA (PLANTAO:INCLUI SABADOS, DOMINGOS E FERIADOS)",,cahmpcosaspe@ig.com.br,1000,0.0,0.0,0.0,0.0,1,1,4.0,NAO,0
3557081,3527203557081,35,352720,48717516000188.0,UNIMED DE LORENA COOPERATIVA DE TRABALHO MEDICO,HOSPITAL UNIMED DE LORENA,,,M,,,M ,MUNICIPAL,4,5,12606580,AVENIDA DOUTOR PEIXOTO DE CASTRO,75,CRUZ,12 31592114,-22.734537,-45.114926,6,"ATENDIMENTO CONTINUO DE 24 HORAS/DIA (PLANTAO:INCLUI SABADOS, DOMINGOS E FERIADOS)",48717516000420.0,diretoria@unimed-lorena.com.br,2143,1.0,0.0,0.0,1.0,1,1,,SIM,42
3559203,3550303559203,35,355030,,HOSPITAL E MATERNIDADE JARDINS LTDA,HOSPITAL E MATERNIDADE JARDINS LTDA,,,M,,,M ,MUNICIPAL,4,5,5404014,RUA ARTUR DE AZEVEDO,1659,PINHEIROS,,-23.5658021,-46.6866092,6,"ATENDIMENTO CONTINUO DE 24 HORAS/DIA (PLANTAO:INCLUI SABADOS, DOMINGOS E FERIADOS)",69106904000100.0,,2062,1.0,0.0,0.0,1.0,1,1,,NAO,26
3580822,3543303580822,35,354330,,REDE DOR SAO LUIZ S A,HOSPITAL RIBEIRAO PIRES,,,M,,,M ,MUNICIPAL,4,5,9424070,DOUTOR NICOLAU ASSEF,52,CENTRO ALTO,11 48271000,-23.71388575,-46.4201803,6,"ATENDIMENTO CONTINUO DE 24 HORAS/DIA (PLANTAO:INCLUI SABADOS, DOMINGOS E FERIADOS)",6047087009780.0,licenciamentosp@rededor.com.br,2046,1.0,1.0,1.0,1.0,1,1,,NAO,71
3585409,3550303585409,35,355030,,SOMEL SOCIEDADE PARA MEDICINA LESTE LTDA,HOSP E MAT STO EXPEDITO,,,M,,,M ,MUNICIPAL,4,5,8260140,RUA TOMOICHI SHIMIZU,201,ITAQUERA,(11)65217799,-23.5774087,-46.439653,6,"ATENDIMENTO CONTINUO DE 24 HORAS/DIA (PLANTAO:INCLUI SABADOS, DOMINGOS E FERIADOS)",4299138000194.0,somelmedicina@uol.com.br,2062,1.0,0.0,1.0,1.0,1,1,,NAO,25
3625087,3503203625087,35,350320,45272366000158.0,UNIMED DE ARARAQUARA COOPERATIVA DE TRABALHO MEDICO,HOSPITAL SAO PAULO,,,M,,,M ,MUNICIPAL,4,5,14800370,AV MARIA ANTONIA DE CAMARGO DE OLIVEIRA,2599,JARDIM NOVA AMERICA,(16)3303-3900,-21.7825365,-48.17200225,6,"ATENDIMENTO CONTINUO DE 24 HORAS/DIA (PLANTAO:INCLUI SABADOS, DOMINGOS E FERIADOS)",45272366001553.0,same@unimedara.com.br,2143,1.0,1.0,1.0,1.0,1,1,,SIM,187
3689972,3506503689972,35,350650,65732836000126.0,UNIMED DE BIRIGUI COOPERATIVA TRABALHO MEDICO,HOSPITAL UNIMED DE BIRIGUI,,,M,,,M ,MUNICIPAL,4,5,16200023,AVENIDA JOAO CERNACK,1000,CENTRO,18 - 36497070,-21.28495365,-50.34278385,6,"ATENDIMENTO CONTINUO DE 24 HORAS/DIA (PLANTAO:INCLUI SABADOS, DOMINGOS E FERIADOS)",65732836000398.0,unimed@unimedbirigui.com.br,2143,1.0,1.0,0.0,1.0,1,1,,NAO,35
3701832,3550303701832,35,355030,,HOSPITAL DE ESPECIALIDADES SILVIO ROMERO LTDA,HOSPITAL SILVIO ROMERO,,,M,,,M ,MUNICIPAL,4,5,3308060,FERNANDES PINHEIRO,268,VILA AZEVEDO,11 22279040,-23.5416149,-46.57215355,6,"ATENDIMENTO CONTINUO DE 24 HORAS/DIA (PLANTAO:INCLUI SABADOS, DOMINGOS E FERIADOS)",7577651000198.0,raimundo.rezende@gmail.com,2062,1.0,0.0,0.0,1.0,1,1,,SIM,26
3753387,3507503753387,35,350750,,MISERICORDIA BOTUCATUENSE BOTUCATU,MISERICORDIA BOTUCATUENSE BOTUCATU,,,M,,,M ,MUNICIPAL,4,5,18602111,PRACA ISABEL FRANCO DE ARRUDA,138,CENTRO,14 38113133,-22.887661,48.445866,6,"ATENDIMENTO CONTINUO DE 24 HORAS/DIA (PLANTAO:INCLUI SABADOS, DOMINGOS E FERIADOS)",45520707000167.0,,3999,1.0,1.0,1.0,1.0,1,1,4.0,NAO,0
3753433,3509703753433,35,350970,,SOCIEDADE BENEFICENTE SAO CAMILO,HOSPITAL LEONOR MENDES DE BARROS,,,E,,,E ,ESTADUAL,4,5,12460000,RUA VEREADOR AGRIPINO LOPES DE MORAES,101,VILA MATHILDE,1236689000,-22.744186,-45.590085,6,"ATENDIMENTO CONTINUO DE 24 HORAS/DIA (PLANTAO:INCLUI SABADOS, DOMINGOS E FERIADOS)",60975737005706.0,secretaria@saocamilo-hlmb.org.br,3999,1.0,0.0,0.0,1.0,1,1,,SIM,26
3774554,3545203774554,35,354520,46634507000106.0,PREFEITURA DA ESTANCIA TURISTICA DE SALTO,HOSPITAL E MATERNIDADE MUNICIPAL N S DO MONTE SERRAT,,,M,,,M ,MUNICIPAL,4,5,13326110,RUA EUROPA,1571,JARDIM CELANI,11-4602-9000,-23.191006,-47.311525,6,"ATENDIMENTO CONTINUO DE 24 HORAS/DIA (PLANTAO:INCLUI SABADOS, DOMINGOS E FERIADOS)",,,1244,1.0,1.0,0.0,1.0,1,1,,SIM,97
3812545,3504003812545,35,350400,,CLINICA MATER DE GINECOLOGIA E OBSTETRICIA S C LTDA,INSTITUTO DE ATENDIMENTO MEDICO HOSPITALAR,,,M,,,M ,MUNICIPAL,4,5,19814570,RUA NAGILA JUBRAN,40,JD EUROPA,18 33241615,-22.65573984,-50.40495157,4,"ATENDIMENTO NOS TURNOS DA MANHA, TARDE E NOITE",612263000151.0,administracao@iamulher.com.br,2062,1.0,1.0,1.0,1.0,1,1,,NAO,13
3824802,3550303824802,35,355030,,REDE D OR SAO LUIZ S A,SAO LUIZ UNIDADE MORUMBI,,,M,,,M ,MUNICIPAL,4,5,5673050,RUA ENGENHEIRO OSCAR AMERICANO,840,MORUMBI,(11) 3093- 1100,-23.57594498,-46.63627625,6,"ATENDIMENTO CONTINUO DE 24 HORAS/DIA (PLANTAO:INCLUI SABADOS, DOMINGOS E FERIADOS)",6047087000309.0,licenciamentosp@rededor.com.br,2046,1.0,0.0,0.0,1.0,1,1,,NAO,178
3880966,3506003880966,35,350600,46374500000194.0,SECRETARIA DE ESTADO DA SAUDE,HOSPITAL DAS CLINICAS DE BAURU HCB,,,E,,,E ,ESTADUAL,4,5,17012900,RUA SILVIO MARCHIONE,320,VILA NOVA CIDADE UNI,,-22.3342392,-49.0611114,4,"ATENDIMENTO NOS TURNOS DA MANHA, TARDE E NOITE",46374500029095.0,,1023,1.0,0.0,0.0,1.0,1,1,,SIM,103
3919072,3550303919072,35,355030,,ACEBRAS SERVICOS MEDICOS HOSPITALARES LTDA,HOSPITAL DOM PEDRO,,,M,,,M ,MUNICIPAL,4,5,3102000,AVENIDA ALCANTARA MACHADO,60,BRAS,3278.001,-23.4853109,-46.3027334,6,"ATENDIMENTO CONTINUO DE 24 HORAS/DIA (PLANTAO:INCLUI SABADOS, DOMINGOS E FERIADOS)",7134908000137.0,NILTON.BATISTA@HOSPITALDOMPEDRO.COM.BR,2062,1.0,0.0,0.0,1.0,1,1,,NAO,133
3949621,3556503949621,35,355650,45780087000103.0,PREFEITURA MUNICIPAL DE VARZEA PAULISTA,HOSPITAL MUNICIPAL DR ALCIPIO DA SILVA OLIVEIRA JUNIOR,,,M,,,M ,MUNICIPAL,4,5,13224240,AVENIDA DO PINHEIRINHO,S/N,JARDIM SATELITE,011 46060546,-23.21192696,-46.83066377,6,"ATENDIMENTO CONTINUO DE 24 HORAS/DIA (PLANTAO:INCLUI SABADOS, DOMINGOS E FERIADOS)",,gestao.varzea@ahbr.org.br,1244,0.0,0.0,0.0,1.0,1,1,,SIM,27
3987957,3522303987957,35,352230,,UNIMED DE ITAPETININGA COOPERATIVA DE TRABALHO MEDICO,HOSPITAL UNIMED DR JOSE SILVA DANTAS FILHO,,,M,,,M ,MUNICIPAL,4,5,18213170,AV WENCESLAU BRAZ,2700,VILA POPULAR,(15) 33769828,-23.56023287,-48.01190346,6,"ATENDIMENTO CONTINUO DE 24 HORAS/DIA (PLANTAO:INCLUI SABADOS, DOMINGOS E FERIADOS)",57149775000574.0,,2143,1.0,1.0,1.0,1.0,1,1,,NAO,40
4049020,3534704049020,35,353470,,ASSOCIACAO DA SANTA CASA DE MISERICORDIA DE OURINHOS,SANTA CASA DE OURINHOS,,,M,,,M ,MUNICIPAL,4,5,19900241,RUA DOM PEDRO I,716,VILA MORAES,14 33026600,-22.983789,-49.863925,6,"ATENDIMENTO CONTINUO DE 24 HORAS/DIA (PLANTAO:INCLUI SABADOS, DOMINGOS E FERIADOS)",53412144000111.0,administracao@santacasadeourinhos.com.br,3999,1.0,1.0,1.0,1.0,1,1,,SIM,173
4051297,3548804051297,35,354880,,HOSPITAL DI THIENE SAO CAETANO LTDA,HOSPITAL DI THIENE SAO CAETANO LTDA,,,M,,,M ,MUNICIPAL,4,5,9510115,JAYME DA COSTA PATRAO,30,SANTO ANTONIO,11 21411800,-23.6170372,-46.572021,6,"ATENDIMENTO CONTINUO DE 24 HORAS/DIA (PLANTAO:INCLUI SABADOS, DOMINGOS E FERIADOS)",21758357000103.0,legalizacao@elosnf.com.br,2062,1.0,0.0,0.0,1.0,1,1,,NAO,72
4060105,3550304060105,35,355030,,HOSPITAL SANTA ISABEL S A,HOSPITAL SANTA ISABEL,,,M,,,M ,MUNICIPAL,4,5,1221900,RUA DOUTOR CESARIO MOTA JUNIOR,112,SANTA CECILIA,(11) 3245-5000,-23.5431724,-46.6499052,6,"ATENDIMENTO CONTINUO DE 24 HORAS/DIA (PLANTAO:INCLUI SABADOS, DOMINGOS E FERIADOS)",43808692000101.0,licenciamenrtosp@rededor.com.br,2054,1.0,0.0,0.0,1.0,1,1,,NAO,125
4077040,3550304077040,35,355030,,CARESURGE LTDA,HOSPITAL INDIANOPOLIS,,,M,,,M ,MUNICIPAL,4,5,4080006,AVENIDA JANDIRA,1134,INDIANOPOLIS,(11) 98529-2641,-23.61235423,-46.65577743,6,"ATENDIMENTO CONTINUO DE 24 HORAS/DIA (PLANTAO:INCLUI SABADOS, DOMINGOS E FERIADOS)",46207912000130.0,marcelo.henrique@caresurge.com.br,2054,1.0,0.0,0.0,1.0,1,1,,NAO,40
4077164,3550304077164,35,355030,,HOSPITAL DIA MONTE CRISTO LTDA,MONTE CRISTO HOSPITAL DE MULTI ESPECIALIDADES,,,M,,,M ,MUNICIPAL,4,5,3323050,DA SAUDADE,218,CIDADE MAE DO CEU,11 33363434,-23.36,-46.36,3,ATENDIMENTOS NOS TURNOS DA MANHA E A TARDE,48611874000101.0,"CONTABILIDADE@HOSPITALDIAMONTECRISTO,COM.BR",2062,1.0,0.0,0.0,1.0,1,1,,NAO,0
4123077,3541004123077,35,354100,,IGESP SA CENTRO MEDICO E CIRURGICO INST GASTROENT DE SP,IGESP SA CENTRO MEDICO E CIRURGICO INST GASTROENT DE SP,,,M,,,M ,MUNICIPAL,4,5,11702210,GUADALAJARA,453,GUILHERMINA,11 35884900,-24.0113956,-46.4432115,6,"ATENDIMENTO CONTINUO DE 24 HORAS/DIA (PLANTAO:INCLUI SABADOS, DOMINGOS E FERIADOS)",61442190001082.0,mara@hospitaligesp.com.br,2054,1.0,1.0,1.0,1.0,1,1,,SIM,71
4135059,3509504135059,35,350950,,PACIFICO OPERACOES HOSPITALARES S A,HOSPITAL SAO LUIZ CAMPINAS,,,M,,,M ,MUNICIPAL,4,5,13013161,AV ANDRADE NEVES,863,CENTRO,(19) 3014-3000,-22.8951526,-47.0740805,6,"ATENDIMENTO CONTINUO DE 24 HORAS/DIA (PLANTAO:INCLUI SABADOS, DOMINGOS E FERIADOS)",40177506000608.0,licenciamentosp@rededor.com.br,2054,1.0,1.0,1.0,1.0,1,1,,NAO,154
4164814,3505704164814,35,350570,,UNIC DAY HOSPITAL MEDICINA E SAUDE LTDA,UNIC DAY HOSPITAL,,,M,,,M ,MUNICIPAL,4,5,6473000,AVENIDA ANDROMEDA,900,GREEN VALLEY ALPHAVI,(11) 2424-3535,-23.48448325,-46.86445935,4,"ATENDIMENTO NOS TURNOS DA MANHA, TARDE E NOITE",40795383000156.0,alessandro@uniccdh.med.br,2062,1.0,0.0,0.0,1.0,1,1,,NAO,3
4193423,3534404193423,35,353440,,HOSPITAL SAO FRANCISCO LTDA,HOSPITAL SAO FRANCISCO,,,M,,,M ,MUNICIPAL,4,5,6016010,PADRE DAMASO,100,CENTRO,11 22846300,-23.53640913,-46.77815437,6,"ATENDIMENTO CONTINUO DE 24 HORAS/DIA (PLANTAO:INCLUI SABADOS, DOMINGOS E FERIADOS)",65705444000330.0,hospsaofrancisco@uol.com.br,2062,1.0,1.0,1.0,1.0,1,1,,NAO,21
