CO_CNES,CO_UNIDADE,CO_UF,CO_IBGE,NU_CNPJ_MANTENEDORA,NO_RAZAO_SOCIAL,NO_FANTASIA,CO_NATUREZA_ORGANIZACAO,DS_NATUREZA_ORGANIZACAO,TP_GESTAO,CO_NIVEL_HIERARQUIA,DS_NIVEL_HIERARQUIA,CO_ESFERA_ADMINISTRATIVA,DS_ESFERA_ADMINISTRATIVA,CO_ATIVIDADE,TP_UNIDADE,CO_CEP,NO_LOGRADOURO,NU_ENDERECO,NO_BAIRRO,NU_TELEFONE,NU_LATITUDE,NU_LONGITUDE,CO_TURNO_ATENDIMENTO,DS_TURNO_ATENDIMENTO,NU_CNPJ,NO_EMAIL,CO_NATUREZA_JUR,ST_CENTRO_CIRURGICO,ST_CENTRO_OBSTETRICO,ST_CENTRO_NEONATAL,ST_ATEND_HOSPITALAR,ST_SERVICO_APOIO,ST_ATEND_AMBULATORIAL,CO_MOTIVO_DESAB,CO_AMBULATORIAL_SUS,leitos
2082624,3550302082624,35,355030,,SOCIEDADE BRASILEIRA E JAPONESA DE BENEFICIENCIA SANTA CRUZ,HOSPITAL JAPONES SANTA CRUZ,,,M,,,M ,MUNICIPAL,4,5,4122000,R SANTA CRUZ,398,VILA MARIANA,(11)50802000,-23.5969409,-46.6327828,6,"ATENDIMENTO CONTINUO DE 24 HORAS/DIA (PLANTAO:INCLUI SABADOS, DOMINGOS E FERIADOS)",60552098000111.0,coordclinica@hospitalsantacruz.com,3999,1.0,0.0,0.0,1.0,1,1,,SIM,152
2082632,3505302082632,35,350530,,ASSOCIACAO DO HOSPITAL E MATERNIDADE SAO JOSE BARRA BONITA,HOSPITAL E MATERNIDADE SAO JOSE BARRA BONITA,,,M,,,M ,MUNICIPAL,4,5,17340104,RUA 14 DE DEZEMBRO,490,JARDIM VISTA ALEGRE,(14) 3604 7114,-22.49450739,-48.55950594,6,"ATENDIMENTO CONTINUO DE 24 HORAS/DIA (PLANTAO:INCLUI SABADOS, DOMINGOS E FERIADOS)",44745024000145.0,comercial@hsjbarrabonita.com.br,3999,1.0,1.0,1.0,1.0,1,1,,SIM,47
2082640,3519602082640,35,351960,,SANTA CASA DE CARIDADE E MATERNIDADE DE IBITINGA,SANTA CASA DE CARIDADE E MATERNIDADE IBITINGA,,,M,,,M ,MUNICIPAL,4,5,14940064,RUA DOMINGOS ROBERT,1090,CENTRO,(16)3352-7711,-21.752664,-48.82755518,6,"ATENDIMENTO CONTINUO DE 24 HORAS/DIA (PLANTAO:INCLUI SABADOS, DOMINGOS E FERIADOS)",49270671000161.0,hospital@santacasaibitinga.com,3999,1.0,1.0,0.0,1.0,1,1,,SIM,76
2082659,3533002082659,35,353300,,IRMANDADE DA SANTA CASA DE MISERICORDIA DE NOVA GRANADA,SANTA CASA DE NOVA GRANADA,,,E,,,E ,ESTADUAL,4,5,15440007,AVN HILDEBERTO DE ALBUQUERQUE FERREIRA,1271,CENTRO,(17) 32625100,-20.538399,-49.324265,6,"ATENDIMENTO CONTINUO DE 24 HORAS/DIA (PLANTAO:INCLUI SABADOS, DOMINGOS E FERIADOS)",53150298000182.0,provedoria.santacasang@hotmail.com,3999,1.0,1.0,0.0,1.0,1,1,,SIM,56
2082667,3531402082667,35,353140,,IRMANDADE STA CASA DE MISERICORDIA DE MONTE APRAZIVEL,HOSPITAL SAO BOM JESUS,,,E,,,E ,ESTADUAL,4,5,15150035,RUA SAO JOAO,729,CENTRO,(17)32751718,-20.77133013,-49.70856728,6,"ATENDIMENTO CONTINUO DE 24 HORAS/DIA (PLANTAO:INCLUI SABADOS, DOMINGOS E FERIADOS)",52879905000187.0,administracao@santacasademonteaprazivel.org.br,3999,1.0,1.0,0.0,1.0,1,1,,SIM,57
2082675,3502802082675,35,350280,,ASSOCIACAO DE AMPARO AO EXCEPCIONAL RITINHA PRATES,ASSOCIACAO DE AMPARO AO EXCEPCIONAL RITINHA PRATES,,,M,,,M ,MUNICIPAL,4,5,16075050,RUA WANDENKOLK,2606,PLANALTO,(18)3117-3627,-21.1868926,-50.46007584,6,"ATENDIMENTO CONTINUO DE 24 HORAS/DIA (PLANTAO:INCLUI SABADOS, DOMINGOS E FERIADOS)",49572688000173.0,dp@ritinhaprates.org.br,3999,0.0,0.0,0.0,0.0,1,1,,SIM,2
2082691,3502102082691,35,350210,,IRMANDADE DA SANTA CASA DE ANDRADINA,SANTA CASA DE ANDRADINA,,,M,,,M ,MUNICIPAL,4,5,16901000,GUANABARA,730,CENTRO,,-20.89611,-51.37944,6,"ATENDIMENTO CONTINUO DE 24 HORAS/DIA (PLANTAO:INCLUI SABADOS, DOMINGOS E FERIADOS)",43535210000197.0,,3999,1.0,1.0,0.0,1.0,1,1,,SIM,91
2082713,3538702082713,35,353870,,AMHPLA COOPERATIVA DE ASSISTENCIA MEDICA,HOSPITAL INDEPENDENCIA DE PIRACICABA,,,M,,,M ,MUNICIPAL,4,5,13416240,AVENIDA INDEPENDENCIA,2475,DOS ALEMAES,(19) 3422-0022,,,6,"ATENDIMENTO CONTINUO DE 24 HORAS/DIA (PLANTAO:INCLUI SABADOS, DOMINGOS E FERIADOS)",74215195001529.0,amhpla@merconet.com.br,2143,1.0,0.0,0.0,1.0,1,1,10.0,SIM,0
2082721,3550602082721,35,355060,,IRMANDADE DA SANTA CASA DE MISERICORDIA DE SAO ROQUE,HOSPITAL E MATERNIDADE SOTERO DE SOUZA,,,M,,,M ,MUNICIPAL,4,5,18130565,RUA SANTA ISABEL,186,VILA MARQUES,11 4719-9360,-23.52895303,-47.13493109,6,"ATENDIMENTO CONTINUO DE 24 HORAS/DIA (PLANTAO:INCLUI SABADOS, DOMINGOS E FERIADOS)",70945936000170.0,administracao@santacasasr.com.br,3999,1.0,1.0,1.0,1.0,1,1,,SIM,43
2082748,3502202082748,35,350220,,IRMANDADE DA SANTA CASA DE ANGATUBA,HOSPITAL ANGATUBA,,,M,,,M ,MUNICIPAL,4,5,18240000,PRC LEVY LISBOA,1202,CENTRO,(15)32551055,-23.4929323,-48.4148352,6,"ATENDIMENTO CONTINUO DE 24 HORAS/DIA (PLANTAO:INCLUI SABADOS, DOMINGOS E FERIADOS)",43600261000155.0,diretoria@santacasadeangatuba.com.br,3999,1.0,1.0,1.0,1.0,1,1,,SIM,40
2082756,3545402082756,35,354540,,HOSPITAL E MAT SAO SEBASTIAO STA CASA MIS SALTO GRANDE,SANTA CASA DE SALTO GRANDE,,,M,,,M ,MUNICIPAL,4,5,19920007,RUA OLIMPIO PIMENTEL,419,CENTRO,(14)3378-1144,-22.8869944,-49.9847283,6,"ATENDIMENTO CONTINUO DE 24 HORAS/DIA (PLANTAO:INCLUI SABADOS, DOMINGOS E FERIADOS)",56690662000195.0,,3999,1.0,1.0,1.0,1.0,1,1,,SIM,25
2082780,3511602082780,35,351160,,BENEFICENCIA HOSPITALAR DE CESARIO LANGE,BENEFICENCIA HOSPITALAR DE CESARIO LANGE,,,M,,,M ,MUNICIPAL,4,5,18287040,AVENIDA SAO PAULO,340,VILA BRASIL,(15)32461628,-23.21956938,-47.9448753,6,"ATENDIMENTO CONTINUO DE 24 HORAS/DIA (PLANTAO:INCLUI SABADOS, DOMINGOS E FERIADOS)",50351626000110.0,admbhcl@hotmail.com,3999,1.0,1.0,1.0,1.0,1,1,,SIM,22
2082799,3537302082799,35,353730,,HOSPITAL LUIZ VALENTE SC LTDA,HOSPITAL LUIZ VALENTE PENAPOLIS,,,M,,,M ,MUNICIPAL,4,5,16300000,AVN LEANDRO RATISSONA DE MEDEIROS,880,PORTAL DOS FAVEIROS,(18)6522310,,,6,"ATENDIMENTO CONTINUO DE 24 HORAS/DIA (PLANTAO:INCLUI SABADOS, DOMINGOS E FERIADOS)",51102697000142.0,,2000,1.0,0.0,1.0,1.0,1,1,4.0,NAO,0
2082810,3513902082810,35,351390,,CONSORCIO DE DESENVOLVIMENTO REG DE GOV DE SJDA BOA VISTA,CONDERG HOSPITAL REGIONAL DE DIVINOLANDIA,,,E,,,E ,ESTADUAL,3,5,13780043,AVN LEONOR MENDES DE BARROS,626,CENTRO,19 3663-8000,-21.6645394,-46.73938,6,"ATENDIMENTO CONTINUO DE 24 HORAS/DIA (PLANTAO:INCLUI SABADOS, DOMINGOS E FERIADOS)",52356268000245.0,conderg@conderg.org.br,1228,1.0,0.0,0.0,1.0,1,1,,SIM,20
2082829,3550302082829,35,355030,46392130000380.0,PREFEITURA DO MUNICIPIO DE SAO PAULO,HOSP MUN PROFESSOR DOUTOR ALIPIO CORREA NETTO,,,M,,,M ,MUNICIPAL,3,5,3807230,ALAMEDA RODRIGO DE BRUM,1989,VILA PARANAGUA,(11)33948030,-23.4996441,-46.4729162,6,"ATENDIMENTO CONTINUO DE 24 HORAS/DIA (PLANTAO:INCLUI SABADOS, DOMINGOS E FERIADOS)",46392148002678.0,VOSILVA@PREFEITURA.SP.GOV.BR,1031,1.0,1.0,1.0,1.0,1,1,,SIM,217
2082845,3533902082845,35,353390,,SANTA CASA DE MISERICORDIA DE OLIMPIA,SANTA CASA DE OLIMPIA,,,M,,,M ,MUNICIPAL,3,5,15400071,RUA SIRIA,139,JARDIM ALVARO BRITO,(17) 32792244,-20.73600739,-48.91819239,6,"ATENDIMENTO CONTINUO DE 24 HORAS/DIA (PLANTAO:INCLUI SABADOS, DOMINGOS E FERIADOS)",53227229000120.0,,3999,1.0,1.0,1.0,1.0,1,1,,SIM,56
2082853,3505902082853,35,350590,,SANTA CASA DE MISERICORDIA ASILO DOS POBRES DE BATATAIS,HOSPITAL MAJOR ANTONIO CANDIDO BATATAIS,,,M,,,M ,MUNICIPAL,4,5,14300033,RUA DR MANOEL FURTADO,235,CENTRO,(16)36601444,-20.88854,-47.583679,6,"ATENDIMENTO CONTINUO DE 24 HORAS/DIA (PLANTAO:INCLUI SABADOS, DOMINGOS E FERIADOS)",44945962000199.0,admin@santacasabatatais.com.br,3999,1.0,1.0,1.0,1.0,1,1,,SIM,73
2082861,3518802082861,35,351880,46319000000150.0,PREFEITURA MUNICIPAL DE GUARULHOS,HOSP MUNICIPAL DE URGENCIAS HMU,,,M,,,M ,MUNICIPAL,4,5,7196000,AVENIDA TIRADENTES,3392,BOM CLIMA,1124757422,-23.46299045,-46.53295755,6,"ATENDIMENTO CONTINUO DE 24 HORAS/DIA (PLANTAO:INCLUI SABADOS, DOMINGOS E FERIADOS)",,HMU@GUARULHOS.SP.GOV.BR,1244,1.0,0.0,0.0,1.0,1,1,,SIM,100
2082888,3543902082888,35,354390,,IRMANDADE DA SANTA CASA DE MISERICORDIA DE RIO CLARO,SANTA CASA DE RIO CLARO,,,M,,,M ,MUNICIPAL,4,5,13500330,RUA 2,297,CENTRO,(19) 3535-7000,-22.41549178,-47.55685329,6,"ATENDIMENTO CONTINUO DE 24 HORAS/DIA (PLANTAO:INCLUI SABADOS, DOMINGOS E FERIADOS)",56384183000140.0,secretaria@santacasaderioclaro.com.br,3999,1.0,1.0,1.0,1.0,1,1,,SIM,141
2082926,3510502082926,35,351050,60194990000178.0,INSTITUTO DAS PEQUENAS MISSIONARIAS DE MARIA IMACULADA,CASA DE SAUDE STELLA MARIS,,,M,,,M ,MUNICIPAL,4,5,11660650,MIGUEL VARLEZ,980,CAPUTERA,012 4221866,-23.624637,-45.423288,6,"ATENDIMENTO CONTINUO DE 24 HORAS/DIA (PLANTAO:INCLUI SABADOS, DOMINGOS E FERIADOS)",60194990001140.0,,3999,1.0,1.0,1.0,1.0,1,1,,SIM,117
2082934,3553002082934,35,355300,,SANTA CASA DE MISERICORDIA DE TAGUAI,SANTA CASA DE MISERICORDIA DE TAGUAI,,,M,,,M ,MUNICIPAL,4,5,18890037,JOAO CARNIATO,90,CENTRO,,-23.45505195,-49.40738727,6,"ATENDIMENTO CONTINUO DE 24 HORAS/DIA (PLANTAO:INCLUI SABADOS, DOMINGOS E FERIADOS)",51504132000191.0,,3999,1.0,1.0,1.0,1.0,1,1,,SIM,17
2082942,3528002082942,35,352800,,IRMANDADE DA SANTA CASA DE MACATUBA,SANTA CASA DE MACATUBA,,,M,,,M ,MUNICIPAL,4,5,17290000,RUA CARLOS GOMES,654,CENTRO,(14)3298-9200,-22.50383726,-48.71431768,6,"ATENDIMENTO CONTINUO DE 24 HORAS/DIA (PLANTAO:INCLUI SABADOS, DOMINGOS E FERIADOS)",51889400000130.0,financeiro@santacasamacatuba.com.br,3999,1.0,1.0,1.0,1.0,1,1,,SIM,24
2083000,3548702083000,35,354870,,SAUDE ABC SERVICOS MEDICOS HOSPITALARES LTDA,HOSPITAL E MATERNIDADE BAETA NEVES,,,M,,,M ,MUNICIPAL,4,5,9751000,AVENIDA PEREIRA BARRETO,846,BAETA NEVES,1141227323,,,6,"ATENDIMENTO CONTINUO DE 24 HORAS/DIA (PLANTAO:INCLUI SABADOS, DOMINGOS E FERIADOS)",4178490000929.0,cristiane.lopes@saudeabc.com.b,2000,1.0,1.0,1.0,1.0,1,1,4.0,SIM,0
2083019,3530102083019,35,353010,46374500000194.0,SECRETARIA DE ESTADO DA SAUDE DE SAO PAULO,HOSPITAL ESTADUAL DE MIRANDOPOLIS DR OSWALDO BRANDI FARIA,,,E,,,E ,ESTADUAL,4,5,16800000,AVN DR RAUL DA CUNHA BUENO,585,CENTRO,(18)37011611,-21.134,-51.102,6,"ATENDIMENTO CONTINUO DE 24 HORAS/DIA (PLANTAO:INCLUI SABADOS, DOMINGOS E FERIADOS)",46374500001247.0,hem-diretoria@saude.sp.gov.br,1023,1.0,1.0,1.0,1.0,1,1,,SIM,75
2083027,3537402083027,35,353740,,SANTA CASA DE MISERICORDIA DE PEREIRA BARRETO,SANTA CASA DE MISERICORDIA DE PEREIRA BARRETO,,,M,,,M ,MUNICIPAL,4,5,15370450,RUA DERMIVAL FRANCESCHI,505,VILA CARVALHO,(18)37044155,-20.6526376,-51.1157255,6,"ATENDIMENTO CONTINUO DE 24 HORAS/DIA (PLANTAO:INCLUI SABADOS, DOMINGOS E FERIADOS)",53966966000144.0,adm@santacasapereirabarrreto.com,3999,1.0,0.0,1.0,1.0,1,1,,SIM,46
2083035,3503902083035,35,350390,,HOSPITAL AMA S A,HOSPITAL AMA S A,,,M,,,M ,MUNICIPAL,4,5,7401305,AV MELVIN JONES,90,JD MODELO,46527500,,,6,"ATENDIMENTO CONTINUO DE 24 HORAS/DIA (PLANTAO:INCLUI SABADOS, DOMINGOS E FERIADOS)",56902018000133.0,diretoria@ama.com.br,2054,1.0,1.0,1.0,1.0,1,1,13.0,NAO,0
2083051,3502502083051,35,350250,,SANTA CASA DE MISERICORDIA DE APARECIDA,SANTA CASA DE APARECIDA,,,E,,,E ,ESTADUAL,4,5,12570000,RUA BARAO DO RIO BRANCO,470,CENTRO,(12)3104-5555,-22.851935,-45.227258,6,"ATENDIMENTO CONTINUO DE 24 HORAS/DIA (PLANTAO:INCLUI SABADOS, DOMINGOS E FERIADOS)",43667179000148.0,faturamento@scma.org.br,3999,1.0,1.0,0.0,1.0,1,1,,SIM,86
2083094,3504002083094,35,350400,46374500000194.0,SECRETARIA DE ESTADO DA SAUDE DE SAO PAULO,HOSPITAL REGIONAL DE ASSIS,,,E,,,E ,ESTADUAL,4,5,19814015,SYMPHRONIO A DOS SANTOS,S/N,CENTRO,(18)3302-6055,-22.667283,-50.411689,6,"ATENDIMENTO CONTINUO DE 24 HORAS/DIA (PLANTAO:INCLUI SABADOS, DOMINGOS E FERIADOS)",46374500012362.0,hra-diretoriageral@saude.sp.gov.br,1023,1.0,1.0,1.0,1.0,1,1,,SIM,88
2083116,3529002083116,35,352900,,IRMANDADE DA SANTA CASA DE MISERICORDIA DE MARILIA,SANTA CASA DE MARILIA,,,M,,,M ,MUNICIPAL,4,5,17515900,AVENIDA VICENTE FERREIRA,828,CASCATA,014-34025555,-22.21337112,-49.93923426,6,"ATENDIMENTO CONTINUO DE 24 HORAS/DIA (PLANTAO:INCLUI SABADOS, DOMINGOS E FERIADOS)",52049244000162.0,SECRETARIA@SANTACASAMARILIA.COM.BR,3999,1.0,0.0,0.0,1.0,1,1,,SIM,187
2083124,3552502083124,35,355250,,HOSPITAL E MATERNIDADE CAMPOS SALLES LTDA,HOSPITAL CAMPOS SALLES,,,M,,,M ,MUNICIPAL,4,5,8676000,AV ANTONIO MARQUES FIGUEIRA,200,JD FIGUEIRA,(11)47454000,,,6,"ATENDIMENTO CONTINUO DE 24 HORAS/DIA (PLANTAO:INCLUI SABADOS, DOMINGOS E FERIADOS)",44409100000141.0,admhmcs@uol.com.br,2000,1.0,1.0,1.0,1.0,1,1,4.0,NAO,0
2083140,3546802083140,35,354680,,IRMANDADE DA SANTA CASA DE MISERICORDIA DE SANTA ISABEL,IRMANDADE DA SANTA CASA DE MISERICORDIA DE SANTA ISABEL,,,M,,,M ,MUNICIPAL,4,5,7500000,AV GUILHERME ALFIERI,205,PARQUE SAO BENEDITO,(11)46561333,-23.3189913,-46.22464299,6,"ATENDIMENTO CONTINUO DE 24 HORAS/DIA (PLANTAO:INCLUI SABADOS, DOMINGOS E FERIADOS)",56898356000149.0,scsi.fatsus@outlook.com,3999,1.0,1.0,1.0,1.0,1,1,,SIM,43
2083175,3537802083175,35,353780,,SANTA CASA DE MISERICORDIA DE PIEDADE,SANTA CASA PIEDADE,,,M,,,M ,MUNICIPAL,4,5,18170000,QUINTINO BOCAIUVA,154,CENTRO,15 32448200,-23.712965,-47.41925,6,"ATENDIMENTO CONTINUO DE 24 HORAS/DIA (PLANTAO:INCLUI SABADOS, DOMINGOS E FERIADOS)",54022967000101.0,assessoria@e-cardosocontabilidade.com.br,3069,1.0,1.0,1.0,1.0,1,1,,SIM,36
2083191,3510602083191,35,351060,,HOSPITAL SANTA CRUZ SOCIEDADE ANONIMA,HOSPITAL ALPHA MED,,,M,,,M ,MUNICIPAL,4,5,6320090,CORIFEU DE AZEVEDO MARQUES,168,CENTRO,11 41858555,-23.52177921,-46.83288088,6,"ATENDIMENTO CONTINUO DE 24 HORAS/DIA (PLANTAO:INCLUI SABADOS, DOMINGOS E FERIADOS)",76555069000224.0,,2054,1.0,0.0,0.0,1.0,1,1,,NAO,41
2083205,3546402083205,35,354640,,MATERNIDADE DONA MARIA PERPETUA PIEDADE GONCALVES,MATER MARIA PERPETUA SCRPARDO,,,M,,,M ,MUNICIPAL,4,5,18900000,PRC SAO SEBASTIAO,509,CENTRO,(14)3721100,,,6,"ATENDIMENTO CONTINUO DE 24 HORAS/DIA (PLANTAO:INCLUI SABADOS, DOMINGOS E FERIADOS)",56813702000149.0,,3999,1.0,1.0,1.0,1.0,1,1,4.0,NAO,0
2083213,3554402083213,35,355440,,IRMANDADE DE MISERICORDIA E HOSPITAL TERRA ROXA,HOSPITAL TERRA ROXA,,,M,,,M ,MUNICIPAL,4,5,14745049,RUA FERNANDO COSTA,2,CENTRO,(17)33951955,-20.79046,-48.33115,6,"ATENDIMENTO CONTINUO DE 24 HORAS/DIA (PLANTAO:INCLUI SABADOS, DOMINGOS E FERIADOS)",47055157000188.0,saude@terraroxa.sp.gov.br,3999,1.0,1.0,1.0,1.0,1,1,,SIM,24
2083248,3548702083248,35,354870,,AMICO SAUDE LTDA,HOSPITAL SANTA HELENA SAO BERNARDO DO CAMPO,,,M,,,M ,MUNICIPAL,4,5,9750660,AVENIDA LUCAS NOGUEIRA GARCEZ,540,JARDIM DO MAR,(21) 4122-8300,-23.6922593,-46.55504713,6,"ATENDIMENTO CONTINUO DE 24 HORAS/DIA (PLANTAO:INCLUI SABADOS, DOMINGOS E FERIADOS)",51722957015295.0,crcosta@amil.com.br,2054,1.0,0.0,0.0,1.0,1,1,,NAO,68
2083256,3530602083256,35,353060,,NOTRE DAME INTERMEDICA SAUDE S A,HOSPITAL SANTANA,,,M,,,M ,MUNICIPAL,4,5,8730500,DOUTOR OSMAR MARINHO COUTO,71,CENTRO,11 31552000,-23.5229721,-46.18787527,6,"ATENDIMENTO CONTINUO DE 24 HORAS/DIA (PLANTAO:INCLUI SABADOS, DOMINGOS E FERIADOS)",44649812027176.0,jenifer.xavier@intermedica.com.br,2054,1.0,0.0,0.0,1.0,1,1,,NAO,91
2083264,3517602083264,35,351760,46634275000188.0,PREFEITURA MUNICIPAL DE GUAPIARA,HOSPITAL MUNICIPAL JOAQUIM RAIMUNDO GOMES GUAPIARA,,,M,,,M ,MUNICIPAL,4,5,18310007,RUA JOAQUIM CECILIO DE LIMA,19,CENTRO,(15) 3547-1270,-24.1845181,-48.52605343,6,"ATENDIMENTO CONTINUO DE 24 HORAS/DIA (PLANTAO:INCLUI SABADOS, DOMINGOS E FERIADOS)",,guapiara@saude.sp.gov.br,1244,0.0,0.0,0.0,1.0,1,1,,SIM,9
2083272,3506352083272,35,350635,68020916000147.0,PREFEITURA MUNICIPAL DE BERTIOGA,HOSPITAL MUNICIPAL DE BERTIOGA,,,M,,,M ,MUNICIPAL,4,5,11250294,PRACA VICENTE MOLINARI,S/N,VILA ITAPANHAU,(13)33199800,-23.84263235,-46.13960237,6,"ATENDIMENTO CONTINUO DE 24 HORAS/DIA (PLANTAO:INCLUI SABADOS, DOMINGOS E FERIADOS)",,seacssbertioga@gmail.com,1244,1.0,1.0,1.0,1.0,1,1,,SIM,28
2083299,3548902083299,35,354890,,UNIMED DE SAO CARLOS COOPERATIVA DE TRABALHO MEDICO,HOSPITAL UNIMED SAO CARLOS,,,M,,,M ,MUNICIPAL,4,5,13560290,RUA DONA ALEXANDRINA,1683,CENTRO,16-21077518,-22.0251789,-47.8894725,6,"ATENDIMENTO CONTINUO DE 24 HORAS/DIA (PLANTAO:INCLUI SABADOS, DOMINGOS E FERIADOS)",45359213000576.0,hospital@unimedsaocarlos.com.br,2143,1.0,1.0,0.0,1.0,1,1,,NAO,56
2083493,3540202083493,35,354020,,IRMANDADE DA SANTA CASA DE MISERICORDIA DE PONTAL,SANTA CASA DE PONTAL,,,M,,,M ,MUNICIPAL,4,5,14180041,RUA ANANIAS COSTA FREITAS,753,CENTRO,(16)39531716,-21.0283183,-48.0375455,6,"ATENDIMENTO CONTINUO DE 24 HORAS/DIA (PLANTAO:INCLUI SABADOS, DOMINGOS E FERIADOS)",55110753000141.0,gerencia@iscmpontal.com.br,3999,1.0,1.0,1.0,1.0,1,1,,SIM,29
2083604,3504502083604,35,350450,,SANTA CASA DE MISERICORDIA DE AVARE,SANTA CASA DE AVARE,,,M,,,M ,MUNICIPAL,4,5,18700110,RUA PARAIBA,1003,CENTRO,(14)37119100,-23.01437582,-49.31333542,6,"ATENDIMENTO CONTINUO DE 24 HORAS/DIA (PLANTAO:INCLUI SABADOS, DOMINGOS E FERIADOS)",44584019000106.0,,3999,1.0,1.0,1.0,1.0,1,1,,SIM,157
2083876,3516302083876,35,351630,,ASSOCIACAO DE BENEFICENCIA E FILANTROPIA SAO CRISTOVAO,SANTA CASA DE MISERICORDIA DE FRANCISCO MORATO,,,M,,,M ,MUNICIPAL,4,5,7990050,DOS CRAVOS,230,BELEM CAPELA,11 20297222,-23.27908135,-46.73910314,6,"ATENDIMENTO CONTINUO DE 24 HORAS/DIA (PLANTAO:INCLUI SABADOS, DOMINGOS E FERIADOS)",60975174003036.0,CTBSC@SAOCRISTOVAO.COM.BR,3999,1.0,1.0,0.0,1.0,1,1,,SIM,60
2083957,3550302083957,35,355030,,HOSPITAL E MATERNIDADE SANTO ANTONIO DO TUCURUVI LTDA,HOSP MAT STO ANTONIO DO TUCURUVI,,,M,,,M ,MUNICIPAL,4,5,2201000,AVN JULIO BUONO,1849,VIL GUSTAVO,(11)02019911,,,6,"ATENDIMENTO CONTINUO DE 24 HORAS/DIA (PLANTAO:INCLUI SABADOS, DOMINGOS E FERIADOS)",60543196000192.0,,2000,1.0,0.0,1.0,1.0,1,1,4.0,NAO,0
2083973,3517702083973,35,351770,,SANTA CASA DE GUARA,SANTA CASA DE GUARA,,,M,,,M ,MUNICIPAL,4,5,14580000,RUA JOSE RIBEIRO CALAZANS,40,VILA VITORIA,(16) 3831-3450,-20.427,-47.819,6,"ATENDIMENTO CONTINUO DE 24 HORAS/DIA (PLANTAO:INCLUI SABADOS, DOMINGOS E FERIADOS)",45331303000125.0,scmguara@com4.com.br,3999,1.0,1.0,1.0,1.0,1,1,,SIM,32
2083981,3552402083981,35,355240,46374500000194.0,SECRETARIA DE ESTADO DA SAUDE DE SAO PAULO,HOSPITAL ESTADUAL SUMARE,,,E,,,E ,ESTADUAL,5,5,13175490,AV DA AMIZADE,2400,JAD BELA VISTA,(19)38838900,-22.82199469,-47.2679472,6,"ATENDIMENTO CONTINUO DE 24 HORAS/DIA (PLANTAO:INCLUI SABADOS, DOMINGOS E FERIADOS)",46374500013768.0,faturamento@hes.unicamp.br,1023,1.0,1.0,1.0,1.0,1,1,,SIM,151
2084023,3532402084023,35,353240,45279643000154.0,PREFEITURA MUNICIPAL DE NAZARE PAULISTA,HOSPITAL MUNICIPAL DE NAZARE PAULISTA,,,M,,,M ,MUNICIPAL,4,5,12960000,RUA EZAU AVELINO PINHEIRO,150,VICENTE NUNES,(11)45971123,-23.1605963,-46.3945885,6,"ATENDIMENTO CONTINUO DE 24 HORAS/DIA (PLANTAO:INCLUI SABADOS, DOMINGOS E FERIADOS)",,saudenazarepta@gmail.com,1244,1.0,1.0,1.0,1.0,1,1,,SIM,13
2084031,3534402084031,35,353440,,HOSPITAL E MATERNIDADE MONTREAL LTDA,HOSPITAL E MATERNIDADE MONTREAL,,,M,,,M ,MUNICIPAL,4,5,6016010,RUA PADRE DAMASO,100,CENTRO,(11)36519000,,,6,"ATENDIMENTO CONTINUO DE 24 HORAS/DIA (PLANTAO:INCLUI SABADOS, DOMINGOS E FERIADOS)",4611114000129.0,cpd@grupomontreal.com.br,2000,1.0,1.0,0.0,1.0,1,1,4.0,NAO,0
2084058,3546402084058,35,354640,,SANTA CASA DE MISERICORDIA DE SANTA CRUZ DO RIO PARDO,SANTA CASA DE MISERICORDIA DE SANTA CRUZ DO RIO PARDO,,,M,,,M ,MUNICIPAL,4,5,18900073,AV DR CYRO DE MELO CAMARINHA,530,CENTRO,(14) 3332-1222,-22.9007075,-49.62788343,6,"ATENDIMENTO CONTINUO DE 24 HORAS/DIA (PLANTAO:INCLUI SABADOS, DOMINGOS E FERIADOS)",56813926000150.0,admsantacasa@tdkom.com.br,3999,1.0,1.0,1.0,1.0,1,1,,SIM,84
2084074,3552602084074,35,355260,,ASSOCIACAO BENEFICENTE DE TABAPUA,HOSP MARIA VALLE PEREIRA DE TABAPUA,,,M,,,M ,MUNICIPAL,4,5,15880025,RUA ADINAEL MOREIRA,1683,CENTRO,(17) 35621811,-20.96107894,-49.03161764,6,"ATENDIMENTO CONTINUO DE 24 HORAS/DIA (PLANTAO:INCLUI SABADOS, DOMINGOS E FERIADOS)",71981476000107.0,juridico@hmvp.com.br,3999,1.0,1.0,0.0,1.0,1,1,,SIM,23
2084090,3547802084090,35,354780,,REDE DOR SAO LUIZ S A,HOSPITAL BARTIRA,,,M,,,M ,MUNICIPAL,4,5,9240410,ALFREDO MALUF,430,VILA ALTO DE SANTO A,(11) 4996-6679,-23.6316903,-46.5251551,6,"ATENDIMENTO CONTINUO DE 24 HORAS/DIA (PLANTAO:INCLUI SABADOS, DOMINGOS E FERIADOS)",6047087007907.0,licenciamentosp@rededor.com.br,2046,1.0,0.0,0.0,1.0,1,1,,NAO,89
2084120,3503302084120,35,350330,,ASSOCIACAO PRO SAUDE,PRO SAUDE HOSPITAL GERAL ARARAS,,,M,,,M ,MUNICIPAL,4,5,13606020,AVENIDA AUGUSTA VIOLA DA COSTA,805,LORETO,(19)33211260,-22.3591847,-47.34796286,6,"ATENDIMENTO CONTINUO DE 24 HORAS/DIA (PLANTAO:INCLUI SABADOS, DOMINGOS E FERIADOS)",66835794000111.0,prosaude@araras.com.br,3999,1.0,0.0,0.0,1.0,1,1,,SIM,11
2084139,3550302084139,35,355030,46392130000380.0,SECRETARIA MUNICIPAL DA SAUDE,HOSPITAL MUNICIPAL DR BENEDITO MONTENEGRO,,,M,,,M ,MUNICIPAL,4,5,3921080,RUA ANTONIO LAZARO,226,JARDIM IVA,11 51782762,-23.587669,-46.515984,6,"ATENDIMENTO CONTINUO DE 24 HORAS/DIA (PLANTAO:INCLUI SABADOS, DOMINGOS E FERIADOS)",46392148002830.0,DTRFORNACIARI@PREFEITURA.SP.GOV.BR,1031,1.0,0.0,0.0,1.0,1,1,,SIM,36
2084163,3513802084163,35,351380,46374500000194.0,SECRETARIA DE ESTADO DA SAUDE DE SAO PAULO,HOSPITAL ESTADUAL DE DIADEMA HOSPITAL SERRARIA,,,E,,,E ,ESTADUAL,4,5,9980150,RUA JOSE BONIFACIO,1641,SERRARIA,(11) 3583-1400,-23.6974289,-46.6130852,6,"ATENDIMENTO CONTINUO DE 24 HORAS/DIA (PLANTAO:INCLUI SABADOS, DOMINGOS E FERIADOS)",46374500013687.0,hed@hed.spdm.org.br,1023,1.0,1.0,1.0,1.0,1,1,,SIM,180
2084171,3551702084171,35,355170,,IRMANDADE DA SANTA CASA DE SERTAOZINHO,HOSPITAL E MATERNIDADE SAO JOSE,,,M,,,M ,MUNICIPAL,4,5,14160180,EPITACIO PESSOA,1741,CENTRO,,-21.1347539,-47.9917958,6,"ATENDIMENTO CONTINUO DE 24 HORAS/DIA (PLANTAO:INCLUI SABADOS, DOMINGOS E FERIADOS)",71326292000103.0,,3999,1.0,1.0,0.0,1.0,1,1,,SIM,106
2084201,3534702084201,35,353470,,UNIMED DE OURINHOS COOPERATIVA DE TRABALHO MEDICO,HOSPITAL UNIMED DE OURINHOS,,,M,,,M ,MUNICIPAL,4,5,19906560,AVENIDA CHOSO MISAT0,120,FAZENDA CHUMBEADA,14 33028304,-22.976802,-49.895302,6,"ATENDIMENTO CONTINUO DE 24 HORAS/DIA (PLANTAO:INCLUI SABADOS, DOMINGOS E FERIADOS)",51427540000359.0,,2143,1.0,1.0,1.0,1.0,1,1,,NAO,37
2084228,3549102084228,35,354910,,SANTA CASA DE MISERICORDIA DONA CAROLINA MALHEIROS,SANTA CASA DE MISERICORDIA DONA CAROLINA MALHEIROS SJBV,,,M,,,M ,MUNICIPAL,3,5,13870720,RUA CAROLINA MALHEIROS,92,VILA CONRADO,19 36332222,-21.9821955,-46.79515739,6,"ATENDIMENTO CONTINUO DE 24 HORAS/DIA (PLANTAO:INCLUI SABADOS, DOMINGOS E FERIADOS)",59759084000194.0,SECRETARIA@SANTACASASJBV.ORG.BR,3999,1.0,1.0,1.0,1.0,1,1,,SIM,131
2084236,3530602084236,35,353060,46374500000194.0,SECRETARIA DE ESTADO DA SAUDE DE SAO PAULO,CENTRO ESP EM REABILITACAO DR ARNALDO PEZZUTI CAVALCANTI MOG,,,E,,,E ,ESTADUAL,3,5,8751001,RODOVIA ENGENHEIRO CANDIDO DO REGO CHAVES,S/N,JUNDIAPEBA,(11) 4723-9922,-23.52273601,-46.19660854,6,"ATENDIMENTO CONTINUO DE 24 HORAS/DIA (PLANTAO:INCLUI SABADOS, DOMINGOS E FERIADOS)",46374500001832.0,cerapc-dirtecnica@saude.sp.gov.br,1023,1.0,0.0,0.0,1.0,1,1,,SIM,76
2084287,3522602084287,35,352260,,IRMANDADE DA SANTA CASA DE MISERICORDIA DE ITAPIRA,SANTA CASA DE MISERICORDIA DE ITAPIRA,,,M,,,M ,MUNICIPAL,4,5,13974347,CORONEL SOUZA FERREIRA,45,SANTA CRUZ,19 38439300,-22.43598127,-46.82682037,6,"ATENDIMENTO CONTINUO DE 24 HORAS/DIA (PLANTAO:INCLUI SABADOS, DOMINGOS E FERIADOS)",49911985000104.0,contabil@santacasaitapira.com.br,3999,1.0,1.0,0.0,1.0,1,1,,SIM,40
2084309,3557102084309,35,355710,,UNIMED SAO JOSE DO RIO PRETO COOPERATIVA DE TRABALHO MEDICO,HOSPITAL UNIMED RIO PRETO,,,M,,,M ,MUNICIPAL,4,5,15505160,RUA SERGIPE,3260,VILA SAO VICENTE,(17)34059100,-20.42345359,-49.97178555,6,"ATENDIMENTO CONTINUO DE 24 HORAS/DIA (PLANTAO:INCLUI SABADOS, DOMINGOS E FERIADOS)",45100138003035.0,dchiaparini@unimedriopreto.com.br,2143,1.0,0.0,0.0,1.0,1,1,,NAO,22
2084325,3509502084325,35,350950,,HOSPITAL CENTRO DO CORACAO LTDA,HOSPITAL CENTRO DO CORACAO,,,M,,,M ,MUNICIPAL,4,5,13035420,RUA SAO CARLOS,369,VIL INDUSTRIAL,(19) 32727000,-22.91473735,-47.06475352,4,"ATENDIMENTO NOS TURNOS DA MANHA, TARDE E NOITE",7034709000157.0,ccor@terra.com.br,2305,0.0,0.0,0.0,0.0,1,1,6.0,NAO,0
2084333,3550302084333,35,355030,,IGESP SA CENTRO MEDICO E CIRURGICO INST GASTROENT DE SP,IGESP PAULISTA,,,M,,,M ,MUNICIPAL,4,5,1331010,SILVIA,276,BELA VISTA,,-23.2681564,-46.7329013,6,"ATENDIMENTO CONTINUO DE 24 HORAS/DIA (PLANTAO:INCLUI SABADOS, DOMINGOS E FERIADOS)",61442190000191.0,mara@hospitaligesp.com.br,2054,1.0,0.0,0.0,1.0,1,1,,NAO,220
2084341,3550302084341,35,355030,,CME CONSULTORIA MEDICA EMPRESARIAL,HOSP STA MAGGIORE BELA VISTA,,,M,,,M ,MUNICIPAL,4,5,1321010,RUA HUMAITA,409,BELA VISTA,(11)31078042,,,6,"ATENDIMENTO CONTINUO DE 24 HORAS/DIA (PLANTAO:INCLUI SABADOS, DOMINGOS E FERIADOS)",71892178000132.0,,2305,1.0,0.0,0.0,1.0,1,1,10.0,NAO,0
2084368,3550302084368,35,355030,,HAPVIDA NOTRE DAME INTERMEDICA SAUDE S A,HOSPITAL NOSSA SENHORA DO ROSARIO,,,M,,,M ,MUNICIPAL,4,5,2122080,RUA DOUTOR EDSON DE MELO,357,VILA MARIA ALTA,1131552072,-23.5128784,-46.5829804,6,"ATENDIMENTO CONTINUO DE 24 HORAS/DIA (PLANTAO:INCLUI SABADOS, DOMINGOS E FERIADOS)",44649812007140.0,t_marcio.anequine@hapvida.com.br,2054,1.0,1.0,1.0,1.0,1,1,,NAO,59
2084376,3550302084376,35,355030,,AMICO SAUDE LTDA,HOSPITAL PAULISTANO,,,M,,,M ,MUNICIPAL,4,5,1321001,RUA MARTINIANO DE CARVALHO,741,BELA VISTA,(11) 3016-1000,-23.56080081,-46.64127588,6,"ATENDIMENTO CONTINUO DE 24 HORAS/DIA (PLANTAO:INCLUI SABADOS, DOMINGOS E FERIADOS)",51722957015708.0,legalizacaobr@amil.com.br,2054,1.0,0.0,0.0,1.0,1,1,,NAO,165
2084406,3550302084406,35,355030,,FUNDACAO NELSON LIBERO CASA DE SAUDE D PEDRO II,CASA DE SAUDE D PEDRO II,,,M,,,M ,MUNICIPAL,4,5,3102000,RUA DA FIGUEIRA,831,MOOCA,(11)33466500,,,6,"ATENDIMENTO CONTINUO DE 24 HORAS/DIA (PLANTAO:INCLUI SABADOS, DOMINGOS E FERIADOS)",61632857000119.0,dompedrohosp.mat@uol.com.br,3000,1.0,1.0,1.0,1.0,1,1,4.0,NAO,0
2084414,3543402084414,35,354340,,SOCIEDADE BENEF HOSPITALAR STA CASA DE MIS DE RIB PRETO,SANTA CASA DE RIBEIRAO PRETO,,,M,,,M ,MUNICIPAL,3,5,14085000,SAUDADE,456,CAMPOS ELISEOS,(16)3605 0606,-21.1680807,-47.8055556,6,"ATENDIMENTO CONTINUO DE 24 HORAS/DIA (PLANTAO:INCLUI SABADOS, DOMINGOS E FERIADOS)",55989784000114.0,stacasarp@netsite.com.br,3999,1.0,1.0,1.0,1.0,1,1,,SIM,229
2084422,3550402084422,35,355040,,HOSPITAL BENEFICIENTE SAO LUCAS DE SAO PEDRO,SANTA CASA DE SAO PEDRO,,,M,,,M ,MUNICIPAL,4,5,13520005,RUA MALAQUIAS GUERRA,254,VILA OLINDA,(19) 3481.92.68,-22.5453593,-47.91414499,6,"ATENDIMENTO CONTINUO DE 24 HORAS/DIA (PLANTAO:INCLUI SABADOS, DOMINGOS E FERIADOS)",70914171000101.0,administracao@hbslsp.org.br,3999,1.0,1.0,1.0,1.0,1,1,,SIM,60
